The Sitemap Settings module is used for configuring the sitemap. The sitemap APIs and associated database schema and SPROCs should remain in the core platform. ,DNN-6629,0,
The Page Manager module is used for managing pages in an individual site. The page tab APIs and associated database schema and SPROCs should remain in the core platform. Any APIs which are strictly used for presentation purposes should be removed from the platform and included with the module. ,DNN-6628,0,
The List module is used for managing system lists by host users. The list APIs and associated database schema and SPROCs should remain in the core platform. ,DNN-6627,0,
The Google Analytics module is used for integrating Google Analytics into a user s website. The Google Analytics APIs and associated database schema and SPROCs should remain in the core platform. ,DNN-6618,0,
The Event Viewer module is used for managing the event logs. The eventlog APIs and associated database schema and SPROCs should remain in the core platform. Any APIs which are strictly used for presentation purposes should be removed from the platform and included with the module. ,DNN-6616,0,
The profilepic imagehandler is very restricted in his functionality. An imagehandler with more possibilities to show and manipulate images would be a great addition to DNN. Please see my pull request. Documentation follows.,DNN-6506,0,
This module should be moved to a separate github repo in the github.com dnncommunity organization. This will impact both installs and upgrades. It also means that the newsletter module page under admin will be removed in both scenarios. ,DNN-6380,0,
Page events were missed from the linked story. We need to ensure there are additional events for the following  will be useful in Content     Page Restored   Page marked as Published,DNN-6234,0,
A few events were missed from the linked story. We need to ensure there are additional events for the following  most are for Content     Group Role Created   Group Role Deleted   Group Role Joined   Group Role Left   UserAuthenticated ,DNN-6216,0,
  Site Settings extension point code references to DigitalAssets Module. This should be something more generic as other module could inject some extensions. The module name used in the extension point metadata should be  SiteSettings . ,DNN-5992,0,
Environments with large numbers of portals exhibit different performance characteristics than environments with a single portal. We need to test the performance of an installation with 100 portals   using the default website template for each portal   by sending random traffic to each of the portals and observing the behavior. ,DNN-5262,0,
" As a site administrator, I want an easy way to add a new group or user to the permissions grid of a content piece so that I can quickly achieve my task.  ",DNN-5080,0,
"We need to improve the performance of a basic page with HTML modules, when visited by Administrators and Host users. This will test the full impact of the Control Bar. We will follow the overall guidelines for this scenario as described in the Epic.",DNN-5042,0,
Relocate Host Settings   Other Settings   Scheduler Mode to a collapsible  Settings  panel at the bottom of the main Scheduler UI view.,DNN-5003,0,
"There should be an API method which can be called within a scheduled task that would append a status message to the job history. Then when the the history is checked through the UI, the administrator could get additional feedback about the progress of the job.",DNN-5002,0,
A user should have the ability to Stop an already executing scheduled job. We need to do a spike to determine the feasibility of allowing this without requiring developers to write more code in their scheduled tasks.,DNN-5001,0,
"When a scheduled job is specified to run on ALL servers, if the site is configured to use Server Groups then the job should only run on servers that are part of the Group.",DNN-5000,0,
"When running a scheduled job, the Next Start is set based on the date time when the job last completed. As a result, the start time for scheduled jobs will  creep  over time and evantually cause problems if you are relying on jobs to run in a specific order. it should be possible that the Next Start is based on the time of the previous Start. ",DNN-4999,0,
We will add a Scheduler Settings option where you can specify the Delay After Site Restart option   in minutes  . The default will be 1 minute but it can be overridden. In both Timer and Request mode the scheduler will not kick off any jobs until the Delay has elapsed.,DNN-4998,0,
"The Schedule Status UI should be enhanced to include the ability to choose a specific server. This will allow you to view what is executing on a specific server, its status and history, and provide the ability to start and stop the scheduler.",DNN-4997,0,
"When managing a scheduled job, it should be possible to specify server names that are not part of the current farm configuration. This is required so that you can configure a single installation and have it work seamlessly in staging and production. From a user interface perspective it would be beneficial to simpy allow for a comma delimited text box for Server data entry   but perhaps also have a dropdown box that contains the list of servers in that environment that the user can select and add to the textbox.",DNN-4996,0,
"When defining a new scheduled task and if running in a web farm, the user should be able to specify the server s  the task needs to execute on ",DNN-4995,0,
"The Recurring and Retry Frequency should also support the ability to execute every X seconds, every X weeks, every X months, and every X years. ",DNN-4994,0,
"When managing a scheduled job you should be able to optionally specify a Start Date and or a Start Time. The scheduler logic will need to be modified to set the NextStart for a task based on the Start Date and Start Time defined for the task. NOTE  this does not guarantee that the job will actually run precisely at the specified Start Date   Start Time. If the server is down at the time it is supposed to run or other jobs are already running, then it will run as soon as the server comes back on online. ",DNN-4993,0,
After adding modifying deleting a scheduled job you should not have to restart the site for the changes to take effect. ,DNN-4992,0,
Main scheduler view should be sort in alphabetical order. It should also have a filter so that you can view the scheduled jobs for a specific Server or All   All should be the default  ,DNN-4991,0,
" As a user, I want to be able to easily upload files so that it doesn t slow down my workflow  ",DNN-4967,0,
" As a user of the site, I want a simple, searchable and usable control to select files so that the page responds quickly and I don t have to work through a very long drop down list to find a file  ",DNN-4966,0,
" As a user of the site, when I upload a file, I want to have the option of using drag and drop, selecting from a list or searching for a file so that I can choose the fastest way of selecting a file for my needs.  ",DNN-4965,0,
Following the process described in the Epic this class needs to be cleaned up so there is only location for RoleController methods.,DNN-4910,0,
Following the process described in the Epic this class needs to be cleaned up so there is only location for UserController methods.,DNN-4909,0,
Following the process described in the Epic this class needs to be cleaned up so there is only location for PortalAliasController methods.,DNN-4907,0,
Following the process described in the Epic this class needs to be cleaned up so there is only location for TabController methods.,DNN-4906,0,
Following the process described in the Epic this class needs to be cleaned up so there is only location for ModuleController methods.,DNN-4905,0,
We need to improve the performance of the Edit Module Settings Scenario. Note this scenario needs to be tested for scalability  large number of pages and folders files  We will follow the overall guidelines for this scenario as described in the Epic.,DNN-4885,0,
We need to improve the performance of the Edit Page Scenario. Note this scenario needs to be tested for scalability  large number of pages and folders files  We will follow the overall guidelines for this scenario as described in the Epic.,DNN-4884,0,
We need to improve the performance of the Register Scenario. We will follow the overall guidelines for this scenario as described in the Epic.,DNN-4883,0,
We need to improve the performance of the Login Scenario. We will follow the overall guidelines for this scenario as described in the Epic.,DNN-4881,0,
"We need to improve the performance of a basic page with HTML modules, when visited by Page Editors and Module Editors. This will test the impact of the Control Bar  with only a few features exposed . We will follow the overall guidelines for this scenario as described in the Epic.",DNN-4880,0,
"We need to improve the performance of a basic page with HTML modules, when visited by regular Registered Users. For registered users there should be only a couple of calls to handle the profile notification info. We will follow the overall gudilines for this scenario as described in the Epic.",DNN-4879,0,
"We need to improve the performance of a basic page with HTML modules, when visited by Anonymous Users. For anonymous users there should be zero database calls  once the content has been cached  We will follow the overall gudilines for this scenario as described in the Epic.",DNN-4877,0,
This is a simple enhancement that provides an option for a site admin to do all the tings neccessary to make a page visible to all users through a command on the Page menu. The detail is described in the attached document.,DNN-4714,0,
We need to capture the Host Email Address from the user when installing. The detailed description of the feature requirements are included in the attached document,DNN-4713,0,
"As a user, I want to see the getting started content in the same language as my website. ",DNN-4380,0,
As a user I want to see content that is specific to my DNN product and product version. ,DNN-4379,0,
As a user I expect that the file uploader   picker functionality and design be consistent throughout the DNN admin. ,DNN-4378,0,
"Admin   Newsletters module did not allow sending newsletter to Social Groups, it allowed to typical Roles, but not Social Groups. Here is how you should verify that 1  Drop a SG module on a page, auto configure and create a new group 2  Go into Admin   Newsletters. There is no way to send newsletter to this new group. The UI has been modified  see attached  to allow findings of Users and Roles. Code has been copied from Compose Message text box. Here is notes from the pull request  Allow newsletter module to be used to send emails to social groups Replace security role checkboxes with token entry UI Allow specification of users roles via URL, to increase reusability in extensions",DNN-3906,0,
"As a user, I want to be able to prevent the Getting Started dialog from opening again until the next upgrade. ",DNN-3822,0,
"As a user, I want to be able to signup for a newsletter from the getting started page. ",DNN-3821,0,
As a user I want to be able to see key pieces of content when I first install or upgrade DNN. ,DNN-3820,0,
Remove teaser host menus from the DNN Platform default install. ,DNN-3819,0,
"As a superuser, I would like the SQL to be displayed with Syntax highlighting. ",DNN-3759,0,
Provide advanced optional features for displaying the results in the SQL module.,DNN-3708,0,
"Provide options to export sql results  CSV, Excel, eMail, ...",DNN-3707,0,
Provide better error management for the SQL module so errors are better displayed and easier to understand.,DNN-3706,0,
"There is known limitation in the Platform that the IUpgradable defined in a Library extension does not get executed just like it gets run for modules. This makes it very harder for Library writer to manage their Upgrade related C  code. Many times they put this under another module, which is a big inconvenience. ",DNN-3702,0,
As a Super User I want to be able to review the dependencies of JavaScript Libraries.,DNN-3676,0,
Permissions can currently be configured for a variety of system resources    DesktopModules    VIEW   defines if a user role can add the specific desktop module type to a page via the control panel ,DNN-3669,0,
Permissions can currently be configured for a variety of system resources    Folders    BROWSE   defines if a user role can view the list of files in the folder    VIEW   defines if a user role can open and view files in the folder    WRITE   full administrative rights to a folder   also known as Full Control in the commercial platform      ADD   defines if a user role can Add folders   or subfolders      MANAGE   defines if a user role can Manage folder settings    DELETE   defines if a user role can Delete a folder    COPY   defines if a user role can Copy a folder ,DNN-3668,0,
Permissions can currently be configured for a variety of system resources    Modules    VIEW   defines if a user role can view the module on a page    EDIT CONTENT   defines if a user role can edit the content of a module    DELETE   defines if a user role can Delete a module    EXPORT   defines if a user role can Export a module    IMPORT   defines if a user role can Import a module    MANAGE   defines if a user role can Manage module settings   not including permissions      FULL CONTROL EDIT   full administrative rights to a module ,DNN-3667,0,
See attached image for setup. ,DNN-3665,0,
" In the event that a user role has been granted FULL CONTROL EDIT rights for a Page, it overrides all other individual permission settings for that user role, and modifying individual permissions will set FULL CONTROL EDIT to  Not Specified .  In the event that a user role has been denied FULL CONTROL EDIT rights for a Page, it overrides all other individual permission settings for that user role, and modifying individual permissions will set FULL CONTROL EDIT to  Not Specified . ",DNN-3653,0,
"In the event that a user is part of multiple roles that have permission specifications for the same resource, Deny will always override Grant   unless the User is an Administrator   ",DNN-3652,0,
As a user I want to be able to visually track the feedback which means removing abrupt changes in the UI. ,DNN-3642,0,
As a user I want to be provided feedback when new files are added to the upload queue. ,DNN-3641,0,
As a user I want to be provided feedback that the system is processing my request. ,DNN-3640,0,
"As a developer I want to be able to specify file picker mode that give users the ability to select images from computer, web, and the local file system   of the DNN site  . ",DNN-3639,0,
As a developer I want the ability to specify the maximum number of uploads at one time. ,DNN-3638,0,
As a developer I want the ability to specify the dimensions by which I want uploaded images to be cropped. ,DNN-3637,0,
As a developer I want the ability to specify that the image tray remains open. ,DNN-3636,0,
As a developer I want the ability to specify that when an image is uploaded it should be forced into edit mode. This applies to single image uploads only. ,DNN-3635,0,
As a developer I want the ability to specify that only certain file type are acceptable. ,DNN-3634,0,
As a developer I want the ability to specify the destination folder of uploaded files. ,DNN-3633,0,
As a developer I want the ability to specify one method of upload   either web or browse   ,DNN-3632,0,
As a user that has uploaded an image and applied some change I would like the ability to undo that change. ,DNN-3631,0,
As a user I want to be able change the size of my photos as I upload them into my site. ,DNN-3630,0,
As a user I want to be able change the rotation of my photos as I upload them into my site. ,DNN-3629,0,
As a user I want to be able change the contrast of my photos as I upload them into my site. ,DNN-3628,0,
As a user I want to be able change the brightness of my photos as I upload them into my site. ,DNN-3627,0,
As a user I want to be able crop images I have uploaded as I load them into my DNN site. ,DNN-3626,0,
As a user I want to be able edit my images as upload them into my DNN site. ,DNN-3625,0,
As a user I want to be able to see images I have uploaded. ,DNN-3624,0,
As a user I want to be able to see what errors occur during the upload process and be able to take action on them at that time. ,DNN-3623,0,
As a user I want to be able to determine if the compressed files I am uploading should either remain compressed or be decompressed upon upload. ,DNN-3622,0,
As a user I want to be able to determine where I am uploading my files to. ,DNN-3621,0,
As a user I want to be able to upload files from the web to my DNN site. ,DNN-3620,0,
As a user I want to be able to upload files from my machine to my DNN site. ,DNN-3619,0,
Create DesktopModules ModuleCreator Templates Snippets which contains user defined code snippets as simple text files. Add an additional tab called Code Snippets which loads the list of items in the  Snippets folder   displays file names minus the .txt extension  . Selecting an item from the list would display the contents of the file in a multiline textbox. ready to be cut and paste it into the Edit File window. Clicking Save will display a popup with a Save As  textbox   displaying the default name from the dropdown if one was selected  . Delete will remove the selected code snippet file from DesktopModules ModuleCreator Templates Snippets. ,DNN-3481,0,
Add a new option in the Modules menu for Create New Module   only visible to Host users   ,DNN-3479,0,
"As a developer, I want to be able to request a JavaScript library be injected into the page ",DNN-3458,0,
"As a super user, I want to be able to uninstall a JavaScript Library extension ",DNN-3454,0,
"As a super user, I want to be able to automatically install a JavaScript Library Extension ",DNN-3453,0,
"As a super user, I want to be able to install a JavaScript Library Extension ",DNN-3452,0,
"We have number of parameters in both the SearchDocument and SearchQuery objects  such as ModuleId, ModuleDefId, TabId, etc. . However, we don t have GroupId. In a multi social group environment, modules usually have just one instance of themselve, but the data has additional property of GroupId to segmenet them from one group to the other. Usually groupId is upplied via query string parameter. Lack of groupid in these objects causes items to be searchable from all the groups. Note  The groupid should be saved or searched only when it s   0  have a look at code around searchDocument.AuthorUserId in AddSearchDocumentParamters method  Unit tests must be written  copy   paste   change from others ",DNN-3416,0,
The scheduled task in Subscriptions will replace the core Messaging Dispatch with the Subscriptions scheduled task.,DNN-3396,0,
"Add a new tab to the Messages module for Subscription Management. Need to remove the dependency on DotNetNuke.SocialLibrary.dll, makes use of   class ControllerBase   class SocialModule   class DotNetNuke.SocialLibrary.Components.Common.Utilities",DNN-3395,0,
"Move Subscription Tests to Platform. Copy existing tests into the Platform Tests Unit folder. Fix any broken tests. Currently dependent on DotNetNuke.dll and Subscriptions, after move will only be dotnetnuke.dll",DNN-3394,0,
"In a webfarm, scheduled tasks can be specified to run on one web server only  in fact this is the recommended configuration for Search tasks . In Azure environment, VM names automatically  or manually  change during re deployments. This leaves schedule tasks to tied to computer names that do not exist any more and thus renders the tasks useless as they will not execute unless the association is changed. One recommendation from cloud team is to use special API from Azure and use Instance name as opposed to computer name. However, this will require writing special code for Cloud.",DNN-3393,0,
Copy the code from existing Evoq Social Subscriptions project into the main DotNetNuke Library project. Should go under Services folder. Check name spaces. Current namespace is namespace DotNetNuke.Subscriptions which should be DotNetNuke.Services.Subscriptions. Merge SQL into 7.1.  7.2 sql file. ,DNN-3391,0,
"Currently Sort Direction is just one direction, we need to ensure that both ascending and descending sort direction is available",DNN-3350,0,
Create   Modify Unit Tests for this new feature of custom sorting,DNN-3349,0,
All Projects are set to store their Web settings in the project. This forces the same configuration on all developers. This setting could be left to each developer to choose how to handle  it would potentially reduce the number of Cassini Web Server instances that get launched when debugging.,DNN-3343,0,
"The Control Panle is being injected into the control tree on ALL requests, and then made visible based on some conditions. This is unneccessary and impacts performance for anonymous users. While some of the conditions require the control to be injected, we can reduce the number of times the ControlPanel is injected by moving the check outside of the control itself.",DNN-3342,0,
We need to reorganize the trunk in preparation for moving to Git GitHub,DNN-3340,0,
Shaun has created the Module Creator module and it needs to be integrated into DNN Platform. The module is well written and already installs and does the db updates required. This means its a simple task to just add the module into the build process and include it in the distro.,DNN-3273,0,
Currently the module has readme.txt files associated with each template that are supposed to have cut and paste code snippets in them. These files need to have some relevant code snippets for common DNN code tasks. A central repo of code snippets on the DNN site would be really useful. If it worked like the Community Voice module then if would be easy to find quality snippets and provides another way for community to contribute and earn reputation.,DNN-3272,0,
"On the Edit Control tab of the module there will be access to the existing Extension Package Wizard so that the developer can easily package their module directly from the module. Currently when Update is pressed the user gets redirected to the Extensions page, this needs to go back to the page with the module that is being developed on it. ",DNN-3271,0,
"On the Edit Control tab of the module there will be access to the existing Extension Editor so that the developer can easily configure their module directly from the module. Currently when Update is pressed the user gets redirected to the Extensions page, this needs to go back to the page with the module that is being developed on it. ",DNN-3270,0,
The Edit Control tab allows the developer to view and edit the source code for any file associated to the module. By default the Select File  option selects the file identified as the  view  control. Selecting a file from the list will display the full path of the file as well as the contents of the file. The contents are displayed using an open source editor control   CodeMirror   which provides code highlighting and line numbers. Modifications can be made to the code and it can be saved in real time for immediate results in the application. ,DNN-3269,0,
SPIKE   need to ensure that country names that are returned by GeoIP are not different  so that UserModuleBase  LookUpCountry can localize ,DNN-3251,0,
"Business Object of saved query, mapping the columns from table. Business Controller for saved queries, it should implement function  SaveQuery   validate required properties   save the object into database   add event log for the script update GetQueries   get the list of all saved queries. GetQuery int id    get the query by id. Delete int id    delete the query by id   add event log for the script delete Test cases for Business Controller.",DNN-3243,0,
"Table  SavedQueries  QueryId INT, Identity, Primary Key  Name nvarchar 50 , not null, unique index   The query name  Content nvarchar max  not null    the query script  Connection nvarchar 50  not null    the connection name which used to execute the script  CreatedByUserID INT, null  CreatedOnDate DateTime, null  LastModifiedByUserID INT, null  LastModifiedOnDate DateTime, null    these 4 columns used for content item Procedures  GetQueries   get all queries list SaveQuery    add a new query or update exist one. DeleteQuery   delete a query",DNN-3242,0,
need to update the following  UserModuleBase  LookUpCountry  Community Library UI UserControls Address.cs various methods  Community Controls CountryListBox CountryListBox.cs  Content Community Controls CountryListBox CountryLookup.cs ,DNN-3237,0,
Need to ensure that UserHostAddress works as expected in different .net versions i.e. both return nothing and not an exception ASP.NET 2.0 HttpContext.Current.Request.UserHostAddress    127.0.0.1  ASP.NET 3.5 HttpContext.Current.Request.UserHostAddress      1 ,DNN-3236,0,
"we re a little limited in test cases due to the code coming from maxmind, but we should create the following    test for invalid IP addres   test for IP that returns no data  e.g. 127.0.0.1    test for valid IP that returns data",DNN-3235,0,
"add panel to host   advanced settings create user control    DesktopModules Admin HostSettings GeoIP.ascx  add simple file upload control to replace the data add textbox to allow entry of an IP and return the data associated with that add label to display the location, name and date of the GeoIP data file  reading from geoipversion.resources file ",DNN-3234,0,
Add the GeoLiteCity.dat database into App Data   Include the license file in  Licenses and in Licenses.txt file create geoipversion.resources file to contain the version date of the geoip file,DNN-3233,0,
could be distributed as a DotNetNuke.Services.GeoIP.dll or compiled into the core DLL ,DNN-3232,0,
