Can t run WordCount example in hadoop kerberized cluster,XD-2642,1,
Shell processor is not thread safe,XD-2637,1,
Update partitionColumn wiki to include mutual exclusiveness of sql and tableName options,XD-2635,1,
For time being checkin UI build artifacts,XD-2631,1,
Add Ambari plugin beta to build and install Spring XD,XD-2630,1,
Test Redis Sentinel setup and document recommended configuration,XD-2628,1,
Add Kafka Native Metadata Store,XD-2621,1,
Update Spring Batch to 3.0.3.RELEASE,XD-2618,1,
Create reactor module in spring xd modules project,XD-2617,1,
Use Kryo instance pooling to reduce instantiation overhead,XD-2612,1,
Add support to track history in message headers,XD-2606,1,
Backport XD 2411 to 1.0.x branch,XD-2600,1,
Create a that uses a Serialized Broadcaster,XD-2599,1,
Add an xd yarn info command to list admin servers and ports,XD-2597,1,
Test recent Hadoop distro changes,XD-2595,1,
Update spring data hadoop version to 2.1.0.RC1,XD-2594,1,
XD Yarn deployment requires the ability to set permsize,XD-2592,1,
Bump Spring Integration to 4.1.2; Spring AMQP to 1.4.2,XD-2591,1,
Create MessageConverter interface to allow user extensions,XD-2590,1,
Create sample application for RxJava,XD-2589,1,
Remove all deprecated compile warnings,XD-2588,1,
Upgrade grunt node plugins,XD-2584,1,
Add RxJava based Stream processor module,XD-2576,1,
Set fixed NPM version for Grunt Gradle Plugin,XD-2572,1,
Create a new Broadcast stream per thread,XD-2570,1,
Update to Spring Boot 1.2.1.RELEASE,XD-2569,1,
Yarn Environment for XD Acceptance Tests,XD-2568,1,
Add support to test XD on YARN in EC2,XD-2566,1,
Remove MongoDB from main DIRT classpath,XD-2565,1,
Move the Hadoop test dependencies to a different project,XD-2562,1,
Upgrade to Reactor 2.0 RC1,XD-2557,1,
Reference documentation on RxJava Stream processor,XD-2556,1,
Add support to read custom module artifact from HDFS,XD-2551,1,
Add support to upload custom module artifact to HDFS,XD-2550,1,
Investigate why CPU startup is high for admin and container servers,XD-2548,1,
Accept any file name for top level module resources,XD-2547,1,
Create AMI for Spark Server installed,XD-2546,1,
Create a loadGenerator source module,XD-2544,1,
Create MessageHandler for RxJava based processor modules,XD-2542,1,
Define developer facing interfaces for RxJava processors,XD-2541,1,
Upgrade to Reactor 2.0 M2,XD-2533,1,
Add support to extend message compression ,XD-2527,1,
Add gradle build support for custom module projects,XD-2523,1,
Add options for supporting compression on the message bus with RabbitMQ,XD-2521,1,
Upgrade to Gradle 2.2,XD-2518,1,
Clean up spring xd batch sub project,XD-2517,1,
Add support for message compression,XD-2513,1,
MQTT Support the New Spring Integration 4.1 Features,XD-2508,1,
script processor options incorrect on docs,XD-2506,1,
Upgrade CI Acceptance AMI to HVM,XD-2504,1,
to use embedded Kafka server,XD-2502,1,
Upgrade to Boot 1.2.0 RELEASE and the dependencies,XD-2501,1,
Investigate lack of falling back to origin master when building docs on a branch,XD-2497,1,
Refactor use of in integration tests,XD-2496,1,
Update Reactor Stream processor to use latest snapshots,XD-2490,1,
Reference documentation on creating Reactive Stream processor sink,XD-2489,1,
Create sample module in spring xd modules for a Reactor Stream processor,XD-2488,1,
Create for Reactor based XD processor sink modules,XD-2487,1,
Update spring data hadoop version to 2.0.4 for XD 1.0.3,XD-2485,1,
Update spring data hadoop version to 2.1.0.M3,XD-2484,1,
Add codec option to hdfs dataset sink,XD-2483,1,
Define developer facing interfaces for Reactor Stream processors,XD-2481,1,
Benchmark Sqoop vs. jdbchdfs,XD-2480,1,
Add support to access Sqoop logs,XD-2478,1,
Add support to stop existing Sqoop jobs,XD-2477,1,
Add batching support to Spring AMQP Rabbit,XD-2475,1,
Add support for bindRequestor and bindReplier,XD-2474,1,
Kafka Bus Add support for ACK mode,XD-2473,1,
Kafka Bus Concurrency and compression support,XD-2471,1,
Kafka Profiling for Base Distributed base benchmarks,XD-2468,1,
Implement a Spark Streaming Driver application that can be controlled as an XD module instance,XD-2467,1,
Implement a dirt plugin for Spark Streaming support,XD-2466,1,
Acceptance test for Kafka as a message bus,XD-2462,1,
Acceptance test for spark app batch job,XD-2456,1,
Implement a Spark Streaming Receiver that binds to the MessageBus,XD-2433,1,
Define developer facing interfaces for Spark Streaming modules,XD-2432,1,
Workaround latest boot snapshot issue,XD-2431,1,
Create a Sqoop job and required batch tasklet integration code,XD-2430,1,
Mysql Libraries not shipped with XD by default,XD-2428,1,
Use repo.spring.io as NPM repository,XD-2427,1,
Profile Improve performance of TupleBuilder,XD-2424,1,
UI Provide fixed version numbers for NPM and Bower dependencies,XD-2422,1,
Kafka Sink Support async Producer,XD-2418,1,
Fix Redis FieldValueCounter repo save method,XD-2412,1,
Make Redis RichGauge repository cluster safe ,XD-2411,1,
"Rename metrics repositories setValue x, y, z to something less javabean ",XD-2410,1,
Enhance module upload to support exploded dirs on the shell side ,XD-2407,1,
Create Sample Module projects,XD-2406,1,
Provide an XD Starter POM for module projects,XD-2404,1,
Spike Study elastic instances and scheduling in Bamboo to create Windows CI infrastructure,XD-2403,1,
EC2 CI build improvements,XD-2401,1,
Research options to improve CI reliability,XD-2400,1,
TCP Client source module throws ,XD-2397,1,
Add support to host custom module in HDFS,XD-2388,1,
Acceptance test for Kafka source and sink,XD-2387,1,
Need TCP Client Source Acceptance test,XD-2386,1,
Document custom module install procedures,XD-2384,1,
Re run Kafka baseline tests in new infrastructure,XD-2382,1,
Add ability to logout using the Admin UI,XD-2378,1,
Add batching support for Rabbit Message Bus,XD-2376,1,
Research reactor stream integration options,XD-2375,1,
Remove Test Scripts From XD,XD-2370,1,
Research Spark integration options phase 2 ,XD-2368,1,
Investigate test failure in CI builds,XD-2367,1,
Remove usage of location ... in module defitions,XD-2364,1,
Created Acceptance CI test environment for 1.0.x,XD-2362,1,
Pre allocate partitions for Kafka message bus,XD-2361,1,
Pre allocate partitions for Kafka source,XD-2360,1,
Add starting offset support for Kafka source,XD-2358,1,
EC2 Integration Tests fail after Boot 1.2 upgrade,XD-2354,1,
Property replacement does not happen in XML class attribute,XD-2352,1,
POM generation creates the correct dependency list,XD-2351,1,
Document 1.1 major features,XD-2346,1,
Allow module compose to specify an explicit type,XD-2343,1,
Deleting a job and then re adding a new definition with the same name fails,XD-2341,1,
Ensure that branch specific documentation is pulled and generated,XD-2340,1,
Remove external config properties for modules,XD-2339,1,
Update Performance AMI to include Kafka,XD-2335,1,
Create base perf test criteria,XD-2334,1,
Add test coverage for Kafka source and sink modules,XD-2333,1,
AdminUI Provide Server Side Cron Expression Validation,XD-2332,1,
Zip created by Publish 1.1 only contains the shell.,XD-2330,1,
Update Hadoop in CI machines,XD-2329,1,
Set auto startup to false in Kafka source,XD-2325,1,
UI Create a dedicated scheduling page for Jobs,XD-2321,1,
UI Create a dedicated Launch Page for Jobs,XD-2320,1,
Add spring xd python to the distribution,XD-2319,1,
Create Boot Starters for Modules,XD-2318,1,
UI Add support for stoppable notifications,XD-2315,1,
Create sample app to demonstrate Kafka integration,XD-2308,1,
Add support for PHD 2.1 XD 1.1 M1 Release ,XD-2307,1,
Add support to install custom module archive,XD-2306,1,
Research refactoring effort for Kafka source to use simple consumer instead of high level API,XD-2304,1,
UI Update AngularJS to v1.3,XD-2302,1,
Research Spark integration options,XD-2301,1,
Placeholder for 1.0.2 and 1.1M1 release testing effort,XD-2299,1,
Review POC and identify scope for gpload as OOTB Batch Job,XD-2298,1,
Add config parameter to enable disable message rates in cluster view,XD-2296,1,
Simple OOTB job for testing,XD-2286,1,
Change composed module behavior to black box ,XD-2285,1,
Vary queue number on 32 core machine ECB 8 ,XD-2283,1,
Vary queue number B 7 ,XD-2282,1,
Vary Producer and Consumer in combination using 2 Queues B 6 ,XD-2281,1,
Vary producer size EC DB 5 ,XD-2280,1,
Vary consumer size EC DB 4 ,XD-2279,1,
Vary queue number ECB 7 ,XD-2278,1,
Vary prefecth size EC DB 3 ,XD-2277,1,
Vary message size EC DB 2 ,XD-2276,1,
Vary Producer and Consumer in combination using 2 Queues ECB 6 ,XD-2275,1,
Upgrade to Spring Integration 4.1.0,XD-2271,1,
Upgrade to Spring Boot 1.2.0,XD-2270,1,
Create a maintenance branch,XD-2268,1,
Vary producers size ECB 5 ,XD-2266,1,
Vary consumers size ECB 4 ,XD-2265,1,
Infrastructure for RabbitMQ Cluster ECB ,XD-2264,1,
Infrastructure for RabbitMQ Cluster DB ,XD-2259,1,
Research adding support for to configure Modules,XD-2258,1,
Vary producers size DB 5 ,XD-2257,1,
Vary consumers size DB 4 ,XD-2256,1,
Vary prefetch size DB 3 ,XD-2255,1,
Vary message size DB 2 ,XD-2254,1,
Baseline tcp measurements DB 1 ,XD-2253,1,
Log version number in log files,XD-2247,1,
Provide Python module to handle I O for implementing a Python shell processor ,XD-2237,1,
Remove logging of password in Shell,XD-2228,1,
Add support for configurable ZK namespace,XD-2226,1,
REST Make the Job Execution REST endpoint pagination aware,XD-2225,1,
REST Make the Configurations REST endpoint pagination aware,XD-2224,1,
Provide proper ordering for all REST endpoints,XD-2223,1,
"Upgrade to Spring 4.1.2, SI 4.1.0, SA 1.4.0",XD-2216,1,
Add acceptance tests for FieldValueCounts and AggregateCounts,XD-2212,1,
Exclude DB initialization for JDBC sink test,XD-2211,1,
Enhance JDBC sink test to include more options,XD-2210,1,
Add acceptance test to include Gemfire use case,XD-2209,1,
Add acceptance test to extract and assert payload from JSON object,XD-2208,1,
Fix failing script integration test,XD-2192,1,
Fix REST endpoint with security enabled,XD-2186,1,
Document how to enable SSL and Basic authentication ,XD-2181,1,
Expose property to change commit interval ,XD-2180,1,
Add remote partitioning on jdbchdfs job,XD-2178,1,
Add support for Pivotal HD 2.1 XD 1.0.2 Release ,XD-2177,1,
Evaluate Spring Boot dependency upgrade,XD-2169,1,
Research the approach for XD Runtime on Mesos ,XD-2166,1,
Provide Docker image for developers,XD-2158,1,
UI Add Tooltip Directive,XD-2155,1,
Research REST endpoint approach to push custom module,XD-2154,1,
Upgrade to spring boot 1.1.7.RELEASE,XD-2147,1,
Upgrade to spring boot 1.1.7.SNAPSHOT,XD-2146,1,
XD Shell needs to be be able to authenticate using basic auth to admin server,XD-2145,1,
Support Spring Boot s single user security configurations,XD-2144,1,
Add Basic Auth support,XD-2143,1,
Deployment properties should use label instead of name,XD-2140,1,
Research integration options for Sqoop tasklet ,XD-2124,1,
Provide kerberos support for HDFS sink,XD-2123,1,
Secure endpoints using either ROLE VIEWER and ROLE ADMIN,XD-2122,1,
Secure all endpoints using LDAP based security configurations,XD-2121,1,
"Provide file based storage for users, groups and roles ",XD-2120,1,
Support accessing admin server endpoints over HTTPS,XD-2119,1,
Create a shell command processor and sink,XD-2118,1,
User wants to select the ec2 zone when deploying XD,XD-2112,1,
XD EC2 needs to provide ability to use a preinstalled zip vs downloading from s3,XD-2110,1,
Allow aggregate counter to increment by some value of the message,XD-2107,1,
MessageBus should see custom SpEL property accessors,XD-2105,1,
Create XD source from POJO annotated Source ,XD-2100,1,
Enable shutdown containers from admin server,XD-2097,1,
UI Visual representation of Stream Job with deployed modules,XD-2096,1,
UI Ability to deploy stream with deployment properties,XD-2095,1,
UI Cluster view of a container,XD-2094,1,
List Streams Jobs based with deployed modules,XD-2093,1,
Research approach to bootstrap custom modules,XD-2091,1,
Custom module packaging strategy,XD-2090,1,
Test Recommended XD Cluster Strategy on slow bad network,XD-2085,1,
Spring XD EC2 needs to setup cluster that uses static resources.,XD-2084,1,
Add a Retry Dead Letter Interceptor to the RabbitMQ Source,XD-2079,1,
Create a Sink and Source for Riak,XD-2073,1,
Provide a way to debug the http source,XD-2069,1,
Tests sporadically fail when checking send counts with rabbit as transport,XD-2066,1,
Investigate setting up performance test environment on cloud providers,XD-2063,1,
Investigate long running tests,XD-2058,1,
Update XD EC2 Acceptance Test Configs to use 1.0.1 repo,XD-2042,1,
Create JDK6 CI build,XD-2036,1,
Fix misc doc formatting issues,XD-2032,1,
Improvements to Tuple project,XD-2031,1,
Use instead of 3rd party library,XD-2029,1,
Add docs for creating a Job Module,XD-2028,1,
Add docs for Creating a job Item Processor ,XD-2027,1,
Handle random available http port for admin server,XD-2026,1,
Fix failing script integration tests,XD-2024,1,
Reorganize TOC for manual,XD-2016,1,
Upgrade to Spring Shell 1.1 GA,XD-2012,1,
Replace xd MongoItemWriter in hdfsmongodb with spring batch MongoItemWriter,XD-2011,1,
Fix package info.java warnings,XD-2010,1,
Verify we meet all requirements to publish to maven central,XD-2008,1,
Acceptance test must be able to handle log names with PID suffix,XD-2007,1,
In s into the lib xd directory ,XD-2003,1,
Rename packages that is applicable for both stream job,XD-2002,1,
Remove unused post module references,XD-1999,1,
Remove jersey test framework for xd lib distribution,XD-1998,1,
Add comprehensive tests for ,XD-1997,1,
Error message about memory leak when ctrl c xd container and xd admin,XD-1991,1,
Add Docs or Reference For Standard Shell Commands e.g. script ,XD-1990,1,
Remove warnings from Shell hadoop commands,XD-1989,1,
Packaging of Guava 17 results in failure to deploy mapreduce job to Hadoop 2.4 based distros,XD-1985,1,
Avoid all modules deploying to the first container instance upon system restart,XD-1984,1,
NodeExists Exception upon container without admin leader,XD-1983,1,
Add Https Support to the HTTP Source,XD-1982,1,
Automatically align version for tomcat components from platform,XD-1981,1,
SSL Support For RabbitMQ Bus and Modules ,XD-1978,1,
Move button to top right,XD-1974,1,
Name the TaskExecutors in the RabbitMessageBus,XD-1970,1,
Dependendcies for Hadoop distros are broken ,XD-1967,1,
StepExecutionInfo can not be retrieved in distributed mode,XD-1965,1,
Servers not finding logging file,XD-1964,1,
Module info for jdbc sink and jobs are unreadable,XD-1961,1,
Remove copyright licence info in UI screens,XD-1955,1,
Automate execution of gradle pushGeneratedDocs,XD-1952,1,
Anchor the footer at the bottom of page,XD-1951,1,
Ensure DSM matrix is diagonal,XD-1949,1,
Build should use Spring Boot plugin version 1.1.4 ,XD-1948,1,
Add stream state tests,XD-1946,1,
Use guava 15.0 for ,XD-1942,1,
Clean up duplicated dependencies from XD on YARN installation,XD-1940,1,
Update to Spring Batch Admin 1.3.0.RC1,XD-1939,1,
Add licence files in distribution for 3rd party dependencies.,XD-1937,1,
Remove jars from .zip packaging whose license prevents distribution,XD-1936,1,
Verify platform compatibility versions with the XD dependencies,XD-1931,1,
Jolokia endpoints returning 404,XD-1929,1,
Find logging configuration relative to environment,XD-1927,1,
Update for new Release,XD-1920,1,
Add Hadoop 2.4.x as an option,XD-1915,1,
Improve getting started docs for installation,XD-1910,1,
Update to Spring Shell 1.0 RC4,XD-1909,1,
Remove Retry from TCP Sink,XD-1908,1,
Handle deploying state at the Admin UI,XD-1907,1,
Handle Status Changes in Client Dynamically update UI ,XD-1906,1,
Improve Logging and mention affected Module,XD-1905,1,
Investigate why netty 3.7 is in xd lib and not 3.6.6,XD-1896,1,
Use Boot plugin and IO Platform for versions where possible,XD-1895,1,
Create documentation section on best practices,XD-1894,1,
Update to Spring Batch 3.0.1 snapshots,XD-1893,1,
Update to Spring Platform 1.0.1,XD-1892,1,
Add configuration files for hornetmq jms provider.,XD-1891,1,
"Create multi container, single host, testing framework",XD-1890,1,
Update Netty to 4,XD-1886,1,
Provide ability to disable tab completion for specific module options,XD-1885,1,
Module option validation not happening anymore,XD-1884,1,
fails when XD HOME ends with a ,XD-1881,1,
Integration test for and aggregate counter,XD-1880,1,
Create test with jdbc sink and initializeDb false,XD-1879,1,
Create low volume http stress test,XD-1878,1,
Create test that uses jsonPath with the filter module,XD-1876,1,
"Document json to tuple, object to json and http client",XD-1874,1,
Investigate JobExecutions page list performance,XD-1873,1,
Create documentation for Batch DB migration,XD-1871,1,
Create way to deploy custom modules for XD on YARN,XD-1863,1,
Combine JobDefinition info and BatchJobInfo endpoints,XD-1859,1,
Provide error location when tapping inexistent stream module,XD-1858,1,
Add option to specify fsUri to hdfs sinks,XD-1856,1,
Update to use SHDP 2.0.0.RELEASE,XD-1855,1,
Remove Hadoop v1 support,XD-1854,1,
Consolidate REST endpoints for batch resources under jobs,XD-1849,1,
Modify REST controller to obtain stream job state,XD-1848,1,
Method for obtaining stream job state,XD-1847,1,
Improve DeploymentVerifier when stream state is complete,XD-1846,1,
Do not allow the use of named channels in composed modules,XD-1839,1,
Job execution display to show job status,XD-1835,1,
Add single threaded executor service to ,XD-1834,1,
Fix JMS Property Names,XD-1833,1,
Add Support for addresses Property on RabbitMQ Source,XD-1824,1,
Investigate need for UI Pagination,XD-1823,1,
Combine Distributed job locator related schema changes into one table,XD-1822,1,
Investigate increased size of XD distribution.,XD-1819,1,
Provide DSL completion after a some channel prefix,XD-1818,1,
Generate asciidoc doc from module options,XD-1816,1,
Acceptance Tests for Labels and taps,XD-1814,1,
Upgrade to Spring Boot 1.1 SNAPSHOT,XD-1813,1,
Support Bus Producer Properties for Dynamic Producers,XD-1812,1,
Add with custom modules location,XD-1811,1,
Improve E2E Test Coverage,XD-1809,1,
Add global Http Interceptor in order to centralize error logging,XD-1808,1,
Paging support for repositories,XD-1807,1,
Add Eclipse target to EC2 build.gradle.,XD-1806,1,
Support the ability to create module definitions in Groovy,XD-1805,1,
Remove unused parser code related to substreams co,XD-1804,1,
Add XmlRootElement to all REST resources,XD-1802,1,
XD EC2 Needs to support for created containers,XD-1795,1,
Jobs are not completely removed from Jobstore ,XD-1793,1,
New job that executes a Spark job,XD-1791,1,
Detect Module Properties for Non existent Modules,XD-1788,1,
Detect Invalid Deployment Properties in the Bus,XD-1787,1,
Support Partitioning Bus Properties in the RedisMessageBus,XD-1786,1,
REST endpoint command interface for runtime module deployment properties,XD-1784,1,
Add HdfsMongoDb Acceptance Test.,XD-1781,1,
Check job restartable flag for JobExecution restart action,XD-1778,1,
Restore deployment properties for orphaned modules,XD-1777,1,
UI Automatically close notification messages,XD-1774,1,
Upgrade Curator to 2.5.0,XD-1773,1,
Update twitterSearchTest to handle the latest release of twitterSearch,XD-1771,1,
User should be able to provide job deployment properties,XD-1769,1,
User should be able to specify deploy properties for Jobs,XD-1768,1,
JobExecution restart action should depend on job deployment status,XD-1767,1,
Failing tcp to file in script tests,XD-1766,1,
Update documentation to list supported Hadoop distributions,XD-1765,1,
Documentation for enhanced HDFS sink with paths based off content,XD-1764,1,
Update to Spring Batch 3.0 RELEASE,XD-1763,1,
"Documentation for data partitioning, and all Rabbit Bus properties",XD-1761,1,
Update spring data hadoop version to 2.0.0.RC4,XD-1756,1,
gemfire source does not offer host nor port options,XD-1755,1,
Change default date formats to be yyyy MM dd ,XD-1753,1,
multiple streams with same port for HTTP Source ,XD-1752,1,
Modules that use tomcat connection pool need to expose configurations,XD-1751,1,
"Investigate skipped tests in build, enable or remove.",XD-1749,1,
Update to Spring Integration 4.0.1,XD-1748,1,
Module deployment order is not guaranteed,XD-1747,1,
Update CI server to run tests that depend on rabbit redis and hadoop,XD-1744,1,
ZooKeeper Admin server node data to have admin server host address,XD-1740,1,
Improve JMX checks for processors taking into account error channels,XD-1734,1,
Investigate fall through of server.yml values when running in YARN,XD-1733,1,
Remove dependency on Sprint Boot in xd dirt tests,XD-1732,1,
Support for UUID suffix for hdfs file names in acceptance tests,XD-1731,1,
Update dependencies in Spring XD Sample Repository,XD-1729,1,
Add Support for Bold Strong Fonts ,XD-1728,1,
Add Stream Job destroy option at the UI,XD-1727,1,
Add a test for inside the DSL definition of a stream,XD-1721,1,
Document OOTB available keys,XD-1720,1,
Twitter Search test uses case sensitive search when it should be case insensitive.,XD-1718,1,
Document that modules can reference property values in servers.yml,XD-1716,1,
Create documentation section for the shell,XD-1715,1,
Show visual representation of stream in admin UI,XD-1713,1,
needs to use http as its test source,XD-1710,1,
"Add entry for phd20, cdh5 and hdp21",XD-1705,1,
Create doc section about quotes handling,XD-1704,1,
Add admin and container memory settings to servers.yml,XD-1703,1,
Remove Hadoop from admin classpath,XD-1702,1,
Disable auto formatting of JavaDoc,XD-1700,1,
Rabbit Sink Acceptance Tests,XD-1699,1,
Enable Job deployment properties for job deploy,XD-1696,1,
Research how to secure Admin s REST endpoints,XD-1695,1,
Add UI screen shots to docs for new features in Alpha ,XD-1687,1,
Pluralization of admin nodes leadership selector group path ,XD-1686,1,
Test integration with jboss queue message,XD-1684,1,
Remove L from Log4j PatternLayout,XD-1679,1,
"XD does not reconnect to jobstore if connection is lost, leaving Jobs in inconsistent state.",XD-1678,1,
Add log full message Property to the Log Sink,XD-1677,1,
Add filepollhdfs Acceptance Tests,XD-1672,1,
Update Spring Batch Admin dependency to release version,XD-1669,1,
Modularize angular app modules based on the functionality,XD-1668,1,
Add Steams page to show job triggers,XD-1667,1,
Tests are failing due to change in JMX endpoint data,XD-1662,1,
Add Zookeeper distribution in the download zip,XD-1660,1,
Add More Sophisticated Retry Configuration to the Rabbit MessageBus,XD-1653,1,
Update HDFS sink to use unique id GUID as part of file name,XD-1651,1,
Update HDFS sink to accept a partition strategy,XD-1650,1,
CLI needs to be setup to use the updated acceptance test structure,XD-1646,1,
Refactor Exception Handling and update JavaDocs for acceptance test,XD-1645,1,
Fail fast admin server if admin s embedded tomcat couldn t start,XD-1642,1,
Update Spring Integration Version to 4.0.0.RELEASE,XD-1634,1,
Update hdfs sink docs,XD-1631,1,
Packaging s that are not used,XD-1630,1,
RabbitMessageBus should prefix all created queues with a prefix in order to support HA,XD-1629,1,
UI The user can view the job properties that were specified when the job definition was created as well as job parameters when it was launched executed,XD-1628,1,
UI The user should be able to view metrics about an executed job.,XD-1625,1,
UI For Hadoop Steps provide a link to the MapReduce Job details in Hadoop. ,XD-1623,1,
Add support for typed Batch Steps,XD-1622,1,
Fix JobCommandTests verification of shell result table rows using specific index,XD-1620,1,
UI The user can stop a specific job execution,XD-1618,1,
UI The user can view progress information about a given step,XD-1617,1,
UI The user should provide username password to gain access to the UI,XD-1616,1,
UI The user can create a new job definition by selecting a job template and providing additional configuration properties,XD-1615,1,
Change SpringSource references in pom.xml to Spring spring.io,XD-1599,1,
Use MessageBus Binding to start underlying endpoint,XD-1598,1,
Update to Spring AMQP 1.3.2,XD-1597,1,
Rabbit Source Should Expose More Container Options,XD-1596,1,
Move resusable analytics repository classes to a new project.,XD-1594,1,
Support Groovy bean definitions as XD extensions,XD-1589,1,
Remove unused .properties files in config and update docs,XD-1576,1,
Add UDP support to reactor syslog source module,XD-1575,1,
JDBC Acceptance tests must jdbc props vs. configProps setting.,XD-1574,1,
Update diagrams that show control transport,XD-1573,1,
Unable to delete composed module,XD-1572,1,
Deployed modules MBeans are not accessible via Jolokia,XD-1570,1,
Rename reactor tcp module to reactor ip since it also supports udp,XD-1569,1,
Update documentation related to transport and controlTransport,XD-1568,1,
Update XD Ec2 deployer to use XD TRANSPORT ,XD-1567,1,
When using transform shell displays error,XD-1561,1,
Payload Conversion will need to migrated to M6 as soon as M6 is available,XD-1559,1,
shell cp command fails,XD-1558,1,
transform processor with script option is broken,XD-1555,1,
Support deploying to multiple containers in EC2 acceptance tests,XD-1545,1,
Update instructions to how to setup admin to use RDBMS.,XD-1543,1,
stack trace on xd admin restart when redploying streams,XD-1540,1,
Eliminate stack trace on xd container shutdown when active module running,XD-1539,1,
Update docs and samples now that deploy is false on job stream creation,XD-1538,1,
Create documentation for Job listeners support,XD-1537,1,
Rename xd config.yml to servers.yml and add to spring xd yarn,XD-1531,1,
Correct hadoop classpath versions for the distros,XD-1529,1,
Support external datasource for single node application,XD-1528,1,
Create small documentation section on jmx monitoring functionalty,XD-1524,1,
