"As a user, I need a sandbox Docker Image so that I can get started to experiment XD deployment with the following setup Ubuntu OS Full XD Jar Java 7.x Redis RabbitMQ",XD-2158,0,
Small follow up story to XD 2094 to improve tooltip handling.,XD-2155,0,
"As a user, I'd like to have latest Spring Boot RELEASE pulled as a dependency so that I can inherit and implement the OOTB security features.",XD-2147,0,
"As a user, I'd like to have latest Spring Boot snapshot pulled as a dependency so that I can inherit and implement the OOTB security features.",XD-2146,0,
"As a user, I want to be able to provide security credentials to the XD Shell so that I can interact with an xd admin server that is secured via basic auth Technical implementation Add password and username to the admin config command. ",XD-2145,0,
"As a user, I'd like to have the option to provide single user security configurations so that I can override them as needed. Reference Spring Boot Security Scope Configurations can be provided through servers.yml file.",XD-2144,0,
"stream create foo definition label bar xxxx stream deploy foo properties seems to work but it does not. The pre validation is correct, but downstream, deployment logic still looks for module.bar instead of module.label ",XD-2140,0,
"As a user, I'd like to have the option of Cassandra sink, so I can leverage the NoSQL database to write high volumes of variable data segments in high velocity.",XD-2130,0,
"As a user, I'd like to have the option of kerberized HDFS sink so that I can leverage Kerberos open source distributed authentication system for secured data writes into Hadoop.",XD-2123,0,
"As a user, I'd like to have the option to configure default access control for endpoints so that I can grant access by Admin or Viewer roles.",XD-2122,0,
Create processor and sink modules that can execute a shell command using stdin and stdout to stream data.,XD-2118,0,
Currently the application allows AWS select which zone in the region to create an instance.,XD-2112,0,
Currently XD EC2 downloads an XD zip file from the location specified by the xd dist url after verifying that the file is accessible.. ,XD-2110,0,
"Currently, the aggregate counter only adds 1 to the individual values, even though support is there to add any increment. This ticket is about surfacing a SpEL expression on the message to choose the increment",XD-2107,0,
"Currently, custom SI property accessors are registered by a plugin and are not visible by the bus. I believe they should be. This may just be a matter of moving them around.",XD-2105,0,
"As a user, I'd like to have the option to write into Kafka sink so that I can publish mass data into Kafka broker.",XD-2103,0,
"Kafka lends itself well as a message bus, and kafka partitioning maps to MB partitioning. Implement KafkaMessageBus and supporting classes and UT IT.",XD-2098,0,
"For a given stream job, we need a visual representation of the stream job with any deployed modules.",XD-2096,0,
"Admin UI currently allows job to be deployed with deployment properties, we need similar way to deploy stream with the deployment properties module count, container matching criteria .",XD-2095,0,
We need a visual representation of the XD cluster with runtime container and deployed modules.,XD-2094,0,
Design Spike Investigate various approaches to bootstrap custom modules. Can Spring Boot be leveraged? Starter POM?,XD-2091,0,
"As a user, I'd like to have guidance to create custom modules so that I can align the development practices with recommended approach. 11 20 Update Scope of this task is to create an example to demonstrate and document the capability.",XD-2090,0,
h1. Run Acceptance tests on the following deployments. ,XD-2085,0,
"h1. Summary User wants the ability to deploy an ec2 cluster where the admin containers use a pre existing ZK ensemble, Rabbit and redis instance that are deployed on different machines. ",XD-2084,0,
Provide for retry and or dead lettering for the rabbit source similar to the rabbit message bus .,XD-2079,0,
"Use a baseline DIRT infrastructure to measure throughput, HA and scalability for various payload sizes. Depends on testing infrastructure setup, configuration and availability.",XD-2063,0,
"As an user, I'd like to have the ability to ingest data into Redis sink.",XD-2061,0,
"As an user, I'd like to have a native JDBC source module to ingest data directly from various databases. ",XD-2060,0,
The goal is to optimize the build process and at the same time validate the feature capabilities as quickly as we can. Investigate the long running tests. Look for long timeout window declarations. ,XD-2058,0,
"As a user, I'd like to have the option to use the SFTP source module so that I can access, transfer, and mange files over any reliable data streams. Reference Spring Integration SFTP Adapter Need to consider the infrastructure for testing.",XD-2044,0,
Update XD EC2 configs to Pull from 1.0.1 Repo Update XD EC2 Configs to use dir Update test configs XD HOME to instead of ,XD-2042,0,
Maybe only have it run after the publish build instead of triggering builds directly from jdk6 7 8.,XD-2036,0,
Spring 4.0 provides a UUID generator used by default in SI that should be used instead of the com.eaoi.uuid library in the xd tuple library,XD-2029,0,
"should be very brief introduction to this topic, before linking to relevant spring batch documentation.",XD-2027,0,
0xData is a rich JVM based machine learning and scoring engine.,XD-2022,0,
"When hdfsmongodb was written Spring Batch did not have a MongoItemWriter available, so Mark wrote one for XD. The hdfsmongodb module now needs to be use Spring Batches MongoItemWriter.",XD-2011,0,
"Container s module deployer has some unused code and has listeners.xml which is no longer used. Also, all the extension code is moved to ",XD-2009,0,
has a list of requirements. This also means that is critical to fix.,XD-2008,0,
"In from a http site and place it in lib xd. from the distribution, the CI tests could not start the XD instances on EC2 without it. It was suggested that we use the postgresql instead, but decided to continue the use of mysql for acceptance tests.",XD-2003,0,
Determine a better package name for the following packages once we have a common model that applies to both stream job ,XD-2002,0,
The jars are incorrectly classified as compile time deps in hadoop vs. testCompile. ,XD-1998,0,
"e.g., ^C09 42 00,882 ERROR The web application appears to have started a thread named but has failed to stop it. This is very likely to create a memory leak. The thread name may be different...",XD-1991,0,
It is documented here But maybe it should also be at the top of the appendix? ,XD-1990,0,
"A possible approach is to set a configurable wait period when the first container arrives. If another container arrives during the wait period, reset the clock. When the wait period expires, start deploying modules. ",XD-1984,0,
"introduces which is not covered by platform. Yet, we should lookup the version to use from other tomcat artifacts, using some gradle magic",XD-1981,0,
The button is at lower left of the page which requires scrolling all the way to the bottom could we move it to top right? Would make clicking back and forth for job executions much easier.,XD-1974,0,
The Rabbit by default. This makes it difficult to debug when multiple modules are in the same container because all threads are named .,XD-1970,0,
We s i the lib directory. That is no longer working and all distros seem to contain mostly the same version hadoop 2.2.0 dependencies This is the list for phd1 now ,XD-1967,0,
"12 30 43,930 WARN main Logging environment value cannot be opened and will be ignored There are extra slashes in there.... probably due to some recent changes related to xd config location in the scripts.",XD-1964,0,
Should be part of the daily build. One easy way to do it would be to use the hardcoded authentication scheme as described here bamboo should mask a property whose name contains password We may want to create a dedicated github user though,XD-1952,0,
The platform uses Boot version 1.1.4 so the plugin version used in build.gradle should match that.,XD-1948,0,
Test to verify stream state is correct after starting stopping containers.,XD-1946,0,
jclouds is not compatible with versions of guava higher than 15.,XD-1942,0,
Remove s from the lib directory in spring xd yarn zip distribution,XD-1940,0,
The work here is doing the research.... should be removed as it is GPL GPL postgresql is BSD so that is ok another issue will handle license file inclusion.,XD-1936,0,
We need to make sure there is no dependency with build.gradle using spring IO platform dependencies. is one such scenario where jolokia dependency went missing.,XD-1931,0,
for singlenode in M7 returned a value..... on master it returns 404 error... ,XD-1929,0,
Hadoop 2.4.1 is now a stable release and we should add support for running against it,XD-1915,0,
Now that the bus supports retry it is no longer necessary to have the retry advice in the TCP Sink.,XD-1908,0,
"When deploying a definition with a container match criteria specified, and no container could be selected the logging is ambiguous and should mention the affected module 11 58 24,089 WARN No currently available containers match criteria somecriteria ",XD-1905,0,
See Requires update to gradle 2.1,XD-1891,0,
Use external JVM launch support provided by the Oracle Tools framework ,XD-1890,0,
It seems that no option validation being Spring or jsr 303 is happening anymore at stream creation time. eg stream create foo definition http port bar log ,XD-1884,0,
"Also, the approach may not work as expected on windows.",XD-1881,0,
use and aggregate counter. Should do a simplified version of this so that we can assert values of the and aggregate counter.,XD-1880,0,
See and The second assert has initializeDb false and so there are double the number of rows running the job a second time.,XD-1879,0,
"The test is very simple, it doesn t even check the results. A small change to so that number of messages to post is specified would be part of this work.",XD-1878,0,
"Port Need to consider how to start the server, maybe use the jvm fork utilities? Look into as well.",XD-1877,0,
The script tests does the following. Filter for good and bad create stream httpfilter http good filter aftergood filter expression true bad filter goodandbad splitter file dir TEST DIR true ,XD-1876,0,
Note that the documentation for the module options in particular for http client should be autogenerated using the following syntax see others ,XD-1874,0,
Update documentation related to database migration with the changes from XD 1822,XD-1871,0,
Need a way for end user to package and add custom modules scripts when deploying XD on YARN. Currently we have a zip file containing all code including modules. It s not convenient to un zip re zip this archive to add custom modules scripts. See ,XD-1863,0,
"Currently, jobs definitions and batch jobs offer similar info related to the job configuration info. The former comes from while the latter comes from Batch Job Repository. We need to combine this together so that it is not confusing to the end user.",XD-1859,0,
See impacted code at ,XD-1858,0,
"We should have an fsUri parameter for hdfs and hdfs dataset sinks so we can write to different file systems hdfs, webhdfs ",XD-1856,0,
The Tap fixture does not need to inherit from Replace moduleName method with moduleToTap. The current tap syntax is and not as currently implemented by the label fixture. ,XD-1853,0,
currently we have batch and jobs. Everything should move to jobs. See for details.,XD-1849,0,
See the design document for more details. The REST controller needs to be modified to obtain stream job state once it is available in ZooKeeper. This depends on XD 1847.,XD-1848,0,
See the design document for more details. This class or perhaps a method on a repository? will need to query ZooKeeper to obtain the state of a stream job in order to pass it along to the REST controller.,XD-1847,0,
"With XD 1311, the job execution list shows the status of the associated job. We need to show the same information for a given job execution.",XD-1835,0,
This will eliminate any race conditions between deployments and containers joining leaving the cluster.,XD-1834,0,
The JMS Source Sink has a pluggable provider default implies activeMQ the property name should be generic found while testing XD 1149 .,XD-1833,0,
Support receiving messages from an HA cluster.,XD-1824,0,
"Currently, there are and tables and we can possibly combine them into one table and have a better schema for this.",XD-1822,0,
"Generate asciidoc fragments for each module s options, this way it is always up to date.",XD-1816,0,
Pass module properties from stream plugin to . Disallow partitioning properties.,XD-1812,0,
Theoretically I would have liked to centralize logging of Http Resource calls global more substantially but see this limitation ,XD-1808,0,
Add paging support for the appropriate accessor methods in repositories,XD-1807,0,
So that the code format matches that of the XD Project.,XD-1806,0,
"XML is currently required for module definitions. XD should also support Java Config and Groovy bean definitions and potentially, SI DSLs. ",XD-1805,0,
"The XD parser had initial support for substreams, which have been subsumed by composed modules. That legacy code is unused and not needed",XD-1804,0,
Create OOTB batch job that executes a job on Spark as a tasklet could be something along this job create yarnJob definition sparkjob class SimpleApp ,XD-1791,0,
stream create foo definition bar baz stream deploy foo ,XD-1788,0,
Detect properties the bus doesn t support.,XD-1787,0,
We need a way to access the deployment properties for the deployed modules. For example runtime module foo.sink.bar 2 ,XD-1784,0,
Create Acceptance Test Add Mongo to Ec2 Acceptance Test Environment.,XD-1781,0,
Automatically close notification messages Polish UI,XD-1774,0,
"At the job definitions page, user should be able to provide the job deployment manifest module count, criteria etc., ",XD-1769,0,
"When clicking deploy from the job definitions page, user should be able to specify the deployment manifest module count, module criteria etc., ",XD-1768,0,
"At the JobExecution page, if the job execution is failed and restartable, then we should enable the restart action only if the job is deployed. Please see for the discussion related to this.",XD-1767,0,
After spring hadoop 2.0 RC4 update.,XD-1765,0,
Update spring data hadoop version to 2.0.0.RC4 and make necessary changes to the YARN configuration.,XD-1756,0,
We have 13 skipped tests now...,XD-1749,0,
Add messages store optimization to the hdfs dataset ,XD-1748,0,
It would be useful to store admin server ip address in ZooKeeper leadership group node to identify admin server and it s admin port. ,XD-1740,0,
Hitting this issue in Chrome Looks like Chrome has some issues with making text bold if the font does not explicitly support it. ,XD-1728,0,
Add an option to destroy the stream job definitions. Also add confirm action that asks for user to confirm to proceed with destroy.,XD-1727,0,
"As a consequence of not fixing XD 1289, we should document keys of the form that are available to users come to mind, there may be others",XD-1720,0,
The TwitterSearch does a case insensitive search. Tests need to do a insensitive check for the keywords in the search result.,XD-1718,0,
Update StreamUtils based on Code Review comments.,XD-1712,0,
Also check the JMX output to see that the filter rejected the entry.,XD-1710,0,
"Document the different onion layers that come in play with regard to quoting and escaping shell, xd parser, SpEL expressions in some cases and provide practical examples to common scenarios ",XD-1704,0,
"Not sure why the Hadoop classes are on the admin servers classpath. There is no way to select the distro, and the Hadoop classes shouldn t be needed except for module info for hdfs sink see XD 1701 ",XD-1702,0,
Support the ability to provide deployment properties for job deploy .,XD-1696,0,
JobScheduler Stream page Job definition XD1615 ,XD-1687,0,
The xd dirt log4j.properties includes the calling line number which is not recommended for production. ,XD-1679,0,
Allows looking at message headers without turning on debugging.,XD-1677,0,
XD 1623 introduced the dependency to a SNAPSHOT version,XD-1669,0,
The streams page needs to be added to the UI at least to show the job triggers that are created while scheduling XD jobs.,XD-1667,0,
Need to update the Jackson parser.,XD-1662,0,
Sonar build is currently failing.,XD-1661,0,
This will reduce one extra step for getting started using XD in distributed mode out of the box ,XD-1660,0,
HDFS sink needs to have unique identifier for container id added as part of file name. Part of the file name in the directory will be the container id GUID like ,XD-1651,0,
This change has to be facilitated because of the XD 1456 and XD 1455 stories.,XD-1646,0,
"StreamUtils HttpTest MqttTest JmsSource StreamUtils stream method should throw instead of a checked exception. XDEc2Validation assertReceived, assertValid should throw instead of a checked exception ",XD-1645,0,
Options that are not covered codec idleTimeout inUsePrefix inUseSuffix inputType overwrite Options Renamed filename is now fileName,XD-1631,0,
Between s from being packaged that are not used.,XD-1630,0,
To configure Rabbit HA a naming convention should be used to identify the queue that need to be mirrored. ,XD-1629,0,
This may require additional support Jiras for Spring Batch,XD-1622,0,
Secure Admin UI to challenge users to enter username and password to gain access.,XD-1616,0,
This is currently in the M6 pom organization url organization ,XD-1599,0,
"If the rabbit source receives a message it can t convert, a is thrown and the message is rejected and requeued , causing an endless loop. Add an . Also consider adding a retry interceptor to do the same for exceptions in modules when using local transport .",XD-1597,0,
"acknowlege more, tx size, prefetch count, concurrency etc.",XD-1596,0,
Modify the to consume .groovy bean definitions as well as XML. ,XD-1589,0,
There are some properties files in the config directory that no longer are needed. We should clean that up and also remove update any documentation references to these files,XD-1576,0,
"Currently the reactor syslog source module only supports TCP. Once we add UDP support, we can probably remove the existing syslog tcp and syslog udp modules.",XD-1575,0,
In this case we will use environment variables to set the JDBC sink settings. Thus we will just remove code.,XD-1574,0,
"The first 2 images in the documentation section linked below should no longer show redis, rabbit, or local for the communication between Admins and Containers. Rather we need to show ZooKeeper. ",XD-1573,0,
the transport option allows udp as well as tcp ,XD-1569,0,
"e.g. Need to update this section maybe others Remove all mentions of Control Bus, and replace any mentions of the transport cmd line arg with the xd.transport property in yml. ",XD-1568,0,
XD EC2 must use environment variable XD TRANSPORT instead of transport to declare data transport for XD.,XD-1567,0,
Currently uses m5 dependency. ,XD-1559,0,
from the wordcount sample xd ! cp You cannot specify option more than once in a single command ,XD-1558,0,
need the ability to support the group option.,XD-1545,0,
Need to update instructions to discuss the setup of the relational database requirement for the xd admin.,XD-1543,0,
Make changes to XD on YARN config that correspond to XD 1499 changes,XD-1531,0,
"Currently, single node application assumes to use hsqldb server by default and starts the hsqldb as it starts. We need a way to provide external datasource and not to start hsqldb by default when the single node starts up.",XD-1528,0,
"Should mention jolokia, how to turn on off boot jolokia http metric monitoring and jmx. Mention the naming strategy to identify modules running in a stream.",XD-1524,0,
"oracle, gemfire xd derby should be the dialect , and sybase",XD-1519,0,
Currently deployments with an understore in XDController should be something else. Need to segment up the url space better for stream jobs to avoid a clash.,XD-1517,0,
This will allow us to use multiple instances of hdfs file sinks and not have any filename path collisions.,XD-1515,0,
"With the introduction of the deployment manifest setting this to false makes it easier to use the deployment manifest, which is the main use case scenario. ",XD-1513,0,
"INFO main Client produces a huge amount of output and is rather distracting, if that specific entry could be at a log level of debug it would make the startup of the server look cleaner.",XD-1510,0,
See the various module.xyz directories here ,XD-1509,0,
See and Both require the stream definition as well as stream deployment manifest.,XD-1504,0,
Describe the algorithm as defined in ,XD-1498,0,
Update code to use the management jolokia endpoint.,XD-1497,0,
A container instance may be designated as belonging to a group. The end user may define this attribute using yaml config as delimited string or an environment variable or groups command line argument. ,XD-1492,0,
Allow users to configure arbitrary key value pairs for a container instance that may be referenced in deployment descriptors to target specific container instances. ,XD-1491,0,
the algorithm and approach in needs to be added to the section on application configuration,XD-1489,0,
For PR see if one can have a test case such that a test module would have a PATH property that overlaps with the environment variable. It should never resolve to the real unix windows path.,XD-1488,0,
"Currently it watches but due to the reuse of that top level node for XD 1483 and XD 1484, we should instead use ",XD-1485,0,
Currently the index is used globally but applied to a range of candidates that can differ based on the match criteria per invocation.,XD-1479,0,
should be Add a test to make sure correlation expressions here work.,XD-1469,0,
"Currently on snapshots, which is oddly pulling in groovy 2.1.0",XD-1464,0,
"This would get rid of the CF specific post module, keeping the general abstraction of http source across CF and non CF environments.",XD-1463,0,
AggregateCounter needs a test case along the lines of of that will demonstrate the base functionality of the module as well as use of the timeField and dateFormat options.,XD-1462,0,
"After some discussion and voting, we decided to remove jmxEnabled as a command line option and have JMX enabled by default. This can be disabled from xd config.yml externally.",XD-1460,0,
"Originally it was placed in the code to prevent overtasking our servers with downloads when people want to install XD. And to allow for faster downloads. However XD Jars are already placed on S3, so this feature is no longer needed.",XD-1457,0,
Replace tests and throws in the XdEc2Validation with asserts in the following methods verifyTestContent verifyLogContent verifySendCounts VerifySendCounts should check for the exact number of Jmx events instead of 0.,XD-1455,0,
"With the addition of zookeeper, a user does not have to specify rabbit or redis for the control channel. This story should allow a user to specify redis, rabbit or no control channel.",XD-1454,0,
Get minimal compilation going in Travis. Redis Rabbit services can be done in a separate story.,XD-1451,0,
Update to Spring for Apache Hadoop 2.0 RC3 Add support for new hadoop distros Pivotal HD 2.0 phd20 Hortonworks HDP 2.1 hdp21 Cloudera CDH5 cdh5 ,XD-1446,0,
Please see the discussion here ,XD-1442,0,
The description in the google doc describes the usage of and ,XD-1441,0,
"See report at This should not happen as the module holds the classes that hold the classloader, but who knows. An integration test that verifies this would be nice, albeit tricky.",XD-1439,0,
The standard that boot performs a database test that fails in xd container since it does not require the use of a database. ,XD-1432,0,
"By default, XD admin server uses hsqldb as data source for batch job repository and uses the default port 9101, specific database location and dbname. This makes the existence of multiple admin server on a same host not possible. ",XD-1431,0,
"3.4.6 was released on 2014.03.10 Especially relevant for us, they updated Netty from 3.2.2 to 3.6.6 ",XD-1427,0,
The grunt build for karma unit tests is currently broken with requireJS support on the XD admin app. ,XD-1425,0,
"The ordering of the lookup should be described, in particular detail on how environment variables can overrride properties. Some details will necessarily change based on outcome of current discussion, but the overall ordering is going to remain.",XD-1423,0,
"Using the jppml evaluator, provide an implementation of the core abstractions in the The initial code for this has been developed in a separate github repo and is located here ",XD-1419,0,
Create an xd yarn script that is more Cloud Foundry like xd yarn push p xd yarn start admin xd yarn start container ,XD-1411,0,
Startup zookeeper on EC2 cluster instances.,XD-1410,0,
The documentation lists the gemfire server sink module s attributes to be gemfireHost and gemfirePort . In the module code they are host and port . The other attributes are correct. ,XD-1409,0,
The throughput module would expect a payload of the type Message byte and look for the byte to be START or STOP strings to trigger a throughput measurement. would be the place for the module to live.,XD-1407,0,
"Currently, XD hast testCompile dependency to use The uses 2.2.2 and it is what spring IO platform uses as well. To keep it all same, we can change this testCompile dependency to use 2.2.2 ",XD-1406,0,
