"As a developer, I'd like to move k8s SPI to it s own repo.",XD-3715,0,
"As a developer, I'd like to upgrade Spring XD s ambari plugin to 1.3 release.",XD-3714,0,
"As a developer, I'd want to document the limitations of HSQL DB when using composed jobs. ",XD-3708,0,
"As a developer, I'd like to upgrade Boot and Spring Cloud Build revisions, so I can leverage the latest updates.",XD-3705,0,
"As a developer, I want to be able to set a partitioning key for the Kafka bus even when there is a single downstream module, so that I can take advantage of the native Kafka partitioning and message ordering support.",XD-3702,0,
"As a developer, I'd like to upgrade to SI 4.2.2.GA release, so I can leverage the latest improvements.",XD-3696,0,
I don t recall why this commit was not applied to master but having the timestamp for each step in the history will be useful. See this github issue ,XD-3693,0,
"As a developer, I'd like to optimize YARN deployer, so I can deploy stream and the modules part of the definition rapidly.",XD-3692,0,
Make it more clear what drivers need to be copied where. See ,XD-3690,0,
Users want the ability to use Composed Jobs specifically parallel Jobs without having to update the configurations for the hsqldb and the Isolation Level for spring batch. These should be set by default. ,XD-3689,0,
"As a developer, I'd like to add state.",XD-3682,0,
"As a developer, I'd like to add support for . This is applicable for existing streams without any deployment context associated with it. ",XD-3680,0,
"As a developer, I'd like to create separate repo for Lattice SPI, so I don t have to bundle all SPI variants under one admin project.",XD-3675,0,
"As a developer, I'd like to submit a PR for existing work on Mesos SPI. ",XD-3672,0,
"As a user, I'd like to have direct shell commands to scale up down a given module instance, so I can avoid SPI specific CLI commands that needs run outside of data flow.",XD-3671,0,
"As a developer, I'd like to revisit the existing design and identify known limitations and or the gaps. ",XD-3670,0,
"As a user, I'd like Flo Graphs as screenshots while referring to the batch DSL, so it will be easy for me to relate to concepts. ",XD-3669,0,
"As a user, I'd like to see the version and SPI type in the about section, so I can confirm which build of I m currently using. ",XD-3668,0,
"As a user, I'd like to use the admin ui and flo with consistent look and feel. ",XD-3666,0,
"As a developer, I'd like to replace all . ",XD-3664,0,
"As a developer, I'd like to replace all references of Spring XD with Spring Cloud Data Flow. ",XD-3662,0,
"As a developer, I'd like to split artifact packaged with hadoop distro specific libraries, so I could avoid adding all variations of hadoop libraries under one project. ",XD-3659,0,
"As a user, I'd like to refer to job orchestration documentation, so I can use it as guideline for building batch workflows. ",XD-3654,0,
"As a user, I'd like to use SpEL expressions inline at the stream definition level, so I can operate on the payload consistently while using any OOTB, including the custom modules. ",XD-3649,0,
"As a developer, I'd like to enhance test coverage to capture DSL and XML generation variants. ",XD-3644,0,
"As a developer, I'd like to review and refactor , so I can improve performance characteristics. ",XD-3641,0,
See This is needed to support channel channel type constructs,XD-3639,0,
"As a developer, I'd like to upgrade to SI 4.2.1 release, so I can take advantage of the latest improvements.",XD-3637,0,
"As a Flo user, I'd like to have as global options at the DSL level, so I can override the defaults at will. ",XD-3636,0,
"As a developer, I'd like to resolve remaining gaps wrt CI pipelines for Data Flow and the family, so I can continuously evaluate functionalities on every commit.",XD-3635,0,
"As a user, I'd like to use SFTP source module, so I can create streaming pipeline with it. However, I cannot see SFTP as OOTB module listed on and as well as the module bits are not available in maven repo ",XD-3633,0,
"As a user, I'd like to use the latest release of sink, so I can create a streaming pipeline to land data in gemfire. ",XD-3631,0,
"As a developer, I'd like to get rid off from XD.",XD-3627,0,
"As a s c d developer, I'd like to break the build lifecycle to bundle SPI deployers individually, so I don t have to build with all the deployer variations as one whole thing.",XD-3624,0,
"As a developer, I'd like to port module to build streaming pipeline.",XD-3622,0,
"As a s c d user, I'd like to deploy data flow on YARN, so I can reuse the existing Hadoop cluster and leverage data flow features to build streaming or batch pipelines.",XD-3619,0,
"As a s c d user, I'd like to have and the like.",XD-3618,0,
"There is a need to customize the ModuleLauncher behavior itself, NOT pass options to modules that are launched, which is already supported for example to set the location of the maven repository. ",XD-3616,0,
"As a XD user, I'd like to have job DSL as an option, so I can leverage the DSL to create comprehensive workflows and orchestrate jobs. ",XD-3603,0,
"As a developer, I'd like to port modules to build streaming pipeline.",XD-3602,0,
"We need to make sure that JMX MBean names are unique, even in the case of labeled modules. The following stream fails for example http filter filter2 filter log A good candidate could be stream name group module label.",XD-3601,0,
"Described in As a developer, I want Input enpoints to be started after all the beans in the context, so that received messages can be delivered to components. ",XD-3597,0,
"As a s c d user, I should be prevented from creating streams with duplicate name. I d expect streams to have unique names all the time. ",XD-3596,0,
"As a s c d developer, I'd like to add test coverage for , so I can verify API contracts at build time. ",XD-3595,0,
"As an s c d user, I'd like to have the option to use named channels , so I can create streaming pipelines without source or sink modules. ",XD-3594,0,
"As a SCDF user, I want to be able to register artifacts as libraries, so that I can reference them in include and exclude statements.",XD-3593,0,
"As an s c d user, I'd like to take advantage of admin running on variety of platforms such as Lattice, YARN or CF. I'd like to access REST APIs consistently across these platforms.",XD-3592,0,
"As an s c d developer, I'd like to move rabbit to a separate repo, so I can consume the test fixtures in different projects.",XD-3587,0,
"As an s c d developer, I'd like to move kafka to a separate repo, so I can consume the test fixtures in different projects.",XD-3586,0,
"As an s c d developer, I'd like to move redis to a separate repo, so I can consume the test fixtures in different projects.",XD-3585,0,
"As an s c d user, I'd like to deploy s c d on Mesos.",XD-3583,0,
"As an s c d user, I'd like to have tab completion on shell, so I can interact with the modules and its available options.",XD-3582,0,
"As a user, I'd like to build stream definitions using dot delimited syntax for resolving properties for Tuple and JSON.",XD-3581,0,
"As a s c d developer, I'd like to explore options to bootstrap and setup Lattice based infrastructure for s c d s bare metal deployment.",XD-3580,0,
"As an XD user, I'd like have support restart an existing composed job, so I could re launch it at will.",XD-3578,0,
"As an XD user, I'd like to click to go the detail page of the job page whether or not the selected entity is singular or part of a composed job.",XD-3576,0,
"As an XD user, I'd like to be able to visually differentiate between job composition workflow and single job.",XD-3575,0,
"As an XD user, I'd like to have a REST endpoint that returns job composition graph, so I can use it to build visual representation of parent child relationship. ",XD-3574,0,
"As an XD user, I'd like to have a REST endpoint that returns job composition , so I can use it to differentiate visual representation between parent child relationship and standalone jobs. ",XD-3573,0,
"As a Spring XD developer, I'd like to port module to build streaming pipeline.",XD-3572,0,
"As a Spring XD developer, I'd like to move to build streaming pipeline.",XD-3571,0,
"In the section starting Now we can configure the app needs to be revised the information is both out of date and, even if up to date, misleading it includes some values as if they are universal, when they are really just examples .",XD-3570,0,
As an XD module developer I would like to use HDFS for my custom module location even when my namenode is configured for HA. We had an issue filed in the spring xd ambari project It seems like custom module doesn t pickup namenode HA? and still use see ,XD-3569,0,
XD Developer does not want the the twitter stream acceptance tests to interfere with other tests.,XD-3566,0,
"As a developer, I want to be able to connect to multiple external systems for the same binding type, so that I can read data from a system and write it to another.",XD-3565,0,
"As a developer, I want to have a abstraction, so that I can support multiple binder types in the future.",XD-3563,0,
"When a default value is an array, the current behavior using toString not only produces useless results like but also constantly changing results.",XD-3560,0,
"As a XD user, I'd like to restart the composed job workflow from Shell UI. ",XD-3559,0,
Verify that the job launch works as we expect for the composed job. ,XD-3558,0,
"As the system, I would like a way to launch a previously deployed job module from another job module. ",XD-3556,0,
"As an XD developer, I'd like to explore options to remove composed job, so I can clean up unused resources and memory footprints. ",XD-3554,0,
"As an XD developer, I'd like to explore options to represent composed job, so I can create a workflow to orchestrate multiple jobs. ",XD-3553,0,
For example the generated value for the cassandra sink results in where the default value changes each time the build is run. ,XD-3552,0,
"As a Spring XD developer, I'd like to move module from XD to s c s repo, so I can use it as source to build streaming pipeline. ",XD-3542,0,
"As a Spring XD developer, I'd like to move module from XD to s c s repo, so I can use it as sink to build streaming pipeline. ",XD-3541,0,
"As a Spring XD developer, I'd like to move module from XD to s c s repo, so I can use it as source to build streaming pipeline.",XD-3531,0,
"As a Spring XD developer, I'd like to move module from XD to s c s m repo, so I can use it as source to build streaming pipeline. ",XD-3525,0,
"As an s c d user, I'd like to upload custom modules using shell rest api, so I can contribute modules and create streaming batch pipelines. ",XD-3521,0,
"As an s c d user, I'd like to the primary pipeline, so I can fork the same data and do some ad hoc analysis without impacting the original stream.",XD-3519,0,
"As an s c d user, I'd like to refer to documentation on direct binding , so I can use it as a reference to deploy a stream that includes directly bound modules. Example aggregate true ",XD-3517,0,
"As an s c d user, I'd like to have documentation on deployment manifest, so I could refer to the relevant bits on . I'd like to understand how streams withe ",XD-3516,0,
"As a s c s user, I'd like to have as the messaging middleware for low latency use cases. ",XD-3512,0,
"As a s c s user, I'd like to have the option to use more than one binder connection factory, so I can mix and match where I consume and publish data. More details here ",XD-3504,0,
"As a user, I m not able to shutdown from Admin UI with the following stream definition deployed. stream create swagataTestIssue definition jdbc query select employee id, employee name, employer from EMPLOYEE password xdpwd hdfs deploy More details here ",XD-3501,0,
"As a s c d developer, I'd like to document the use of BOM templates, so the general audience can use it as a reference to include external libraries dynamically.",XD-3494,0,
"As a XD developer, I'd like to upgrade to SI 4.2, Spring 4.2.1, and AMQP 1.5 dependencies, so I can take advantage of the latest improvements. ",XD-3493,0,
"As a XD developer, I'd like to move header enricher from modules repo to XD proper. ",XD-3492,0,
"As a s c d user, I'd like to have the option to choose Hadoop distribution of choice, so I can load the right Hadoop libraries in the CP. ",XD-3489,0,
"As a s c d developer, I'd like to refactor CC SPI deployer with CF java client, so I can improve the overall design and performance. ",XD-3488,0,
"As a s c d developer, I'd like to pass any overrides via external config file, so I can influence and override the default module configurations. ex module resolution from a different maven coordinate . ",XD-3487,0,
"As a s c d developer, I'd like to add support for having different binder types for module s channels, so I can plug as the source or sink to read and write respectively.",XD-3486,0,
"As a s c d developer, I'd like to move to build streaming pipeline.",XD-3485,0,
"As a s c s m developer, I'd like to move to build streaming pipeline. See also XD 2250",XD-3482,0,
"As a s c s developer, I'd like to support XD like features where modules bind to incoming messages via expressions or other mechanism, so I can bind message properties to every microservice modules. ",XD-3481,0,
"As a XD user, I'd like to orchestrate composed jobs, so I can bring multiple jobs into single workflow and operationalize.",XD-3479,0,
"As a XD developer, I'd like to explore repository options for composed jobs , so I have the leverage to read write composed job definitions.",XD-3478,0,
"The CF implementation requires that a route be created for each new app. This works fine on the happy path, but is brittle. For example, it will fail if the route required already exists.",XD-3471,0,
"As a s c d developer, I'd like to add hdfs sink to module registry, so I can use this module to build streaming pipeline and write to Hadoop.",XD-3466,0,
"As a s c d developer, I'd like to document Running on Cloud Foundry section in README, so it can be publicly available as deployment guideline.",XD-3463,0,
"As a s c d user, I'd like to create a new banner, so I can embed and display the banner when the shell server boots up. Perhaps use this banner generator ",XD-3462,0,
We in yml files. Need to make define version during a build and allow to override location of those files.,XD-3461,0,
Create Parent pom file for build Create .settings file Migrate Timestamp task from SCSM to SCTM. ,XD-3456,0,
"As a module author, I would like to apply RxJava processor module with spring cloud stream. ",XD-3454,0,
"Upload of module launcher bits is slow because we do not take into account the CC cache. To fix this we need to use an async upload, and to somehow generate the SHA, etc, for the Module Launcher so that CC can pre empt uploading all the bits every time.",XD-3453,0,
"Currently we handle only a single page response from CC SPI list requests, but potentially there could be multiple ones.",XD-3452,0,
"Currently we deploy a single instance, and ignore the instances setting. It is easy to change this in the ModuleDeployer, but there is no guarantee this will work in the ModuleLauncher, so we hold off until that can be verified.",XD-3450,0,
"As a s c d developer, I'd like to produce ref. documentation for s c d architecture, so I could define 1.x and 2.x deployment differences. ",XD-3447,0,
"As a s c s developer, I'd like to fix the binder, so I can create messaging microservices apps and successfully bind them to an operational Kafka broker. ",XD-3445,0,
"As a s c d developer, I'd like to setup branch for s c d and s c s m repos, so I can start pushing documentation with PR commits.",XD-3444,0,
Create a timestamp job that will be used a a sample for users to create their own spring boot based jobs. ,XD-3436,0,
"The document requires update for running it on standalone, docker, lattice. Also, the docker compose yml requires fix so that modules in there are bound together.",XD-3432,0,
"As a s c d developer, I'd like to have .",XD-3425,0,
As via the CLI. ,XD-3423,0,
Can take from previous implementation in Should have a way to enforce not skipping tests based on an environment variable. Consider moving this coverage to SI commons or equivalent. ,XD-3421,0,
"As a s c d developer, I'd like to create implementation, so I can use this infrastructure to lookup module coordinates by name.",XD-3419,0,
"As a s c s developer, I'd like to enable , so I can pull the module artifacts from local instead of remote maven repo.",XD-3418,0,
Make implement SmartLifecycle so that it gets started with the highest precedence and before any other message producing bean.,XD-3417,0,
"As a s c d developer, I'd like to create foundation to support processor as OOTB modules, so I can use the processor modules from repo to build streaming pipeline.",XD-3416,0,
"As a s c d developer, I'd like to create a new project to contain all the rules associated contract, so it is isolated from core functionalities and reusable by test coverage as needed. Consider moving this coverage to SI commons or equivalent. ",XD-3414,0,
"As a Spring XD developer, I'd like to port SFTP module from XD to s c s repo, so I can use it as source modules to build streaming pipeline. ",XD-3412,0,
"As a s c d developer, I'd like to move the external library to its own project, so we have a clear separation of functionalities in s c d repo.",XD-3411,0,
"As a s c s developer, I'd like to refactor the current API, so we don t have to maintain duplicate functionality.",XD-3406,0,
"As a s c d developer, I'd like to experiment how do we resolve and then add module dependent JAR s to Boot loader, so I have an approach to handle external libraries required by OOTB modules. ",XD-3405,0,
"As a s c d developer, I'd like to make the deployer work asynchronously, so I can use the shell to return quickly and also queue deploy operations within YARN as tasks.",XD-3404,0,
"As a s c d developer, I'd like to add support to deploy YARN App into HDFS automatically, so I can have the orchestrate overall deployment by leveraging the manifest to deploy where and with what assets.",XD-3401,0,
"As a s c d user, I'd like to have the option to support passing definition parameters into YARN container, so I can effectively use those params within the module running inside the container.",XD-3400,0,
Build SCS and SCD projects upon change in github repo. Push docker image for SCD Admin to docker hub,XD-3399,0,
"As a s c s developer, I'd like to create auto configuration for binder so I can automatically configure the Spring application based on the dependencies.",XD-3398,0,
As a user I should be able to use the existing admin UI client for spring cloud data admin with the appropriate server configurations.,XD-3397,0,
"Spring cloud data admin requires lattice connector and dependencies so that the admin controllers get access to any services while running on lattice. One example is, CounterContoller using redis service for MetricRepository.",XD-3396,0,
Improve Spring Cloud Stream module launcher resolver properties 1 Support comma separated remoteRepositories 2 Classify group the properties,XD-3395,0,
"As a s c d developer, I'd like to upgrade API changes, so I can sync up and take advantage of the recent improvements. ",XD-3393,0,
"As an s c d developer, I'd like to investigate the distributed deployment of s c s modules on YARN, so I can experiment the implementation of YARN SPI and derive the strategy for .",XD-3384,0,
"Currently, which itself has the meat of the configuration . This is typically what boot AutoConfiguration is for. Moreover, adding a new binding eg Kafka or a stub for module testing would require to crack open EnableModule",XD-3380,0,
"As a Spring XD user, I'd like to use the latest releases of .",XD-3378,0,
"As a Spring XD developer, I'd like to port modules to build streaming pipeline.",XD-3370,0,
"As a Spring XD developer, I'd like to move module from XD to s c s repo, so I can use it as source modules to build streaming pipeline. ",XD-3365,0,
"As a Spring XD developer, I'd like to port module to build streaming pipeline. ",XD-3363,0,
"As a Spring XD developer, I'd like to port module in streaming pipeline. ",XD-3362,0,
Enable spring cloud config for all modules Add spring cloud config client to pom dependencies. Add bootstrap.yml to scs project ,XD-3360,0,
"As a s c d developer, I'd like to derive a strategy for module metadata via command in shell to list all the module properties. ",XD-3355,0,
This could focus only on the subset Stream operations ,XD-3354,0,
As a user I would like to have shell interface to the spring cloud data rest API. The scope for this JIRA could be limited to stream commands.,XD-3353,0,
Create Confguration and Configuration must support replacing the default Kryo Codec implementation with something else.,XD-3352,0,
"As a s c d developer, I'd like to add support to expose counter metrics endpoints, so I can consume to feed the dashboards to demonstrate pipe.",XD-3350,0,
"As an s c s developer, I'd like to brainstorm and design the foundation to port XD modules as s c s modules, so I can use it as the base and start migrating the modules.",XD-3349,0,
"As a s c d developer, I'd like to add support for profiles to the core profile would use in memory strategy to store the metadata.",XD-3348,0,
Apply the same strategy for the Module Command Tests also to all other Shell integration tests.,XD-3347,0,
"As a s c d developer, I'd like to implement undeploy operation for single JVM , so I can use this target to undeploy a running stream. More details in this PR Note Its a prerequisite to determine consistent undeploy strategy for both . ",XD-3344,0,
"As a s c d developer, I'd like to publish the s c d image to DockerHub, so I can incrementally push the latest commits to the remote location.",XD-3341,0,
"As s ex direct binding of two modules that include different versions of spring data , I have the capability to resolve and include the right bits at runtime.",XD-3339,0,
"As s, so I can decide the binding selection and fallback mechanism when there is none setup.",XD-3337,0,
"The current implementation makes use of cf java client, which is relatively heavy for our needs. It should be removed in favour of a bespoke RestOperations wrapper. See for sample code.",XD-3334,0,
This class should not know what the test app is. This means changing the constructors on ,XD-3333,0,
As part of moving to a bespoke RestOperations application we will need credentials to access CloudFoundry. These will need to be supplied from the new XD Admin app at runtime.,XD-3332,0,
The current ModuleRunner is test app used for validation. This should be replaced by a real app.,XD-3331,0,
Currently undeploy is a no op.,XD-3330,0,
Currently there is no returned. This issue will fill in the details.,XD-3329,0,
Remove all stubs and check all required information is returned accurately.,XD-3328,0,
"A ModuleDefinition contains parameters, which need to be passed to the CloudFoundry application. Currently these are put directly into the application s environment. This issue will verify they are correctly named.",XD-3326,0,
ModuleDefinition contains bindings that need to be passed to the ModuleRunner app. It appears these can be included in the application s environment.,XD-3325,0,
"As a s c s developer, I'd like to setup CI infrastructure for s c s m repo, so I can build the project continuously on every commits. ",XD-3322,0,
"As a s c d user, I'd like to add REST support for stream commands, so I can maneuver streaming pipeline backed by StreamController.",XD-3320,0,
"As a s c s developer, I'd like to investigate the right approach to port module from XD, so I can decide better handling of HDFS dependencies, which needs loaded and available in root CP at the runtime. ",XD-3319,0,
"As a s c s developer, I'd like to bootify , so I can use Spring Boot s support for property, setting, as well as adding options and new functionality in the future, such as CP augmentation. ",XD-3318,0,
"As a s c d developer, I'd like to resolve and then add module dependent JAR s to Boot loader, so I have an approach to handle external libraries ex database drivers required by OOTB modules. ",XD-3317,0,
"As a s c d developer, I'd like to setup CI infrastructure for s c d repo so I can build the project continuously on every commits. ",XD-3316,0,
"As a s c s developer, I'd like to adapt redis from XD to s c s, so I can build streaming pipes using s c s modules with simple counters to feed dashboards. ",XD-3315,0,
"As a s c d developer, I'd like to invoke REST APIs via shell, so I can validate operations.",XD-3314,0,
"As a spring cloud data developer, I'd like to use an in memory stream definition repository, so I don t have to spin up a store; obviously, this will not persist between application executions, but it will be useful for a simplified development experience. ",XD-3313,0,
"As a s c s developer, I'd like to move from s c s to s c repo, so I can cleanup s c s project and at the same time make these modules visible outside of s c s.",XD-3312,0,
"As a s c d developer, I'd like to create stubs, so I can create mock streams by interacting with the registry APIs.",XD-3311,0,
"As a s c d developer, I'd like to establish the foundation to expose REST APIs to interact with the and likewise perform CRUD operations to maneuver streaming and batch pipelines. ",XD-3310,0,
"As a s c s user, I'd like to have the option to direct bind modules , so I don t have to use messaging middleware and I can eliminate latency between them. This is important for high throughput and low latency use cases. ",XD-3309,0,
"As a developer, I need to be able to run batch jobs that use the centrally configured job repository to store job state. ",XD-3300,0,
As files as Diego Tasks. ,XD-3298,0,
As as a task on CF and obtain the result reliably. ,XD-3296,0,
