we need a batching JDBC channel adapter is not batching statements AFAICT ,XD-471,0,
we need a JDBC sink for writing to HAWQ using and postgresql JDBC driver ,XD-470,0,
spring data hadoop 1.0.1.RC1 provides flavors for commonly used Hadoop distros versions and we should make use of that.,XD-469,0,
Support toString to emit JSON by default. Should be backed by a simple strategy to allow the possibility of other representations. Also provide toTuple String json . This supports seamless mapping JSON Tuple in XD,XD-466,0,
A pause means that a trigger will wait to fire its job until after the pause is removed. It does not apply the misfire behavior. ,XD-459,0,
Commonly called Calendar support ,XD-458,0,
"In the case that there are not enough resources to fire a trigger, the highest priority will be fired first.",XD-457,0,
We need to have the ability to set read timeout for http request. This is already implemented here ,XD-445,0,
"Dependent servers should be required on the CI server, but optional on developer systems.",XD-444,0,
Once issues like XD 438 have been completed the wiki doc will need updates to reflect the current behaviour and syntax options.,XD-442,0,
Looking at the latest Sonar run we have 3 package tangles in Spring XD ,XD-437,0,
Currently s with runtime dependencies,XD-436,0,
The basic launch configurations should be tested automatically to ensure that startup scripts and launch aren t broken by changes.,XD-435,0,
XD 162 requires registering message converters with the ChannelRegistry. End user needs to configure this statically as the Spring configuration is not exposed.,XD-432,0,
Avoid the need for on the same server,XD-430,0,
test the deployed module sub section uses curl.,XD-426,0,
Add section to Analytics chapter on use of AggregateCounter. The example should show the use of the shell to create the tap that uses the AggregateCounter.,XD-420,0,
See The existing docs should be made to show a real stream being created with filter and or transformer and then a tap that goes to logging. The shell syntax to also stop undeploy a tap should be shown here as well since the lifecycle is discussed.,XD-419,0,
There are existing commands that can be taken from or that can be used for this,XD-402,0,
"the current streams chapter shows using curl to post some data to a http source module, curl d hello create a shell command so curl doesn t have to be used. has a command already developed for this.",XD-401,0,
"the current streams chapter shows creation and deleting streams using CURL switch to use shell. Also add listing of a stream. there is also an example of creating a stream, this should be replaced as well. ",XD-400,0,
The chapter on how to start up the shell should ocme right after start the runtime and before create the stream ,XD-399,0,
This should likely be in the start the runtime section of Getting Started section.,XD-396,0,
Have proper exceptions for common error cases on Stream and propagate those to clients correctly.,XD-385,0,
see StreamsRepository as an example. This includes in memory and Redis implementations,XD-382,0,
see create TapsController if necessary,XD-380,0,
see create optionally deploys,XD-378,0,
see Create the deployer if it doesn t exist.,XD-377,0,
see Create the controller if it doesn t exist. Test with MvcTest,XD-376,0,
To store it s definition and optionally deploy with autostart flag,XD-373,0,
Deploy an existing job. Must exist in the JobsRepository,XD-372,0,
optional autostart switch to also deploy the job,XD-371,0,
Deploy a named stream. The stream must exist in the StreamRepository,XD-370,0,
This is currently too chatty. It should be possible to use a single connection for each increment operation.,XD-368,0,
"Get closure on open discussion points for REST API wrt to streams, taps and jobs. ",XD-367,0,
when posting the DSL to create a spring batch job e.g. trigger job.xml option1 foo it should be stored in redis so that a listing of XD job definitions can be retrieved.,XD-366,0,
Right now the PPC for jolokia mgmt is conflicting with the PPC used to resolve redis properties. Need to determine a strategy such that multiple PPCs can be used.,XD-365,0,
Simple cron based triggers,XD-358,0,
"It might be worth creating a base class for Plugins that combines common concerns across plugins. E.g. That would allow us to hide the and for common cases, instead exposing a simple addBeanDefinition method to sub classes. ",XD-357,0,
"startup scripts on windows should be tested, xd admin, xd container, xd shell.",XD-356,0,
"Need to understand how individual modules may or may not share Dispatchers that are part of the parent context. If modules have their own dispatchers, those also need to be configurable.",XD-355,0,
Currently Jobs can be either executed using cron expression or immediately at once. We should also support the one time scheduling of jobs in the future. Would this possibly require us to implement That could severely impact story points.,XD-349,0,
Trigger Add support for fixed delay interval,XD-348,0,
The object naming is still not ideal for XD since SI conventions add some noise. Likely need to design and implement a custom naming strategy,XD-343,0,
"There s on the claspath that needs cleanup. Building and running with xd singlenode script gave this error Jun 27, 2013 3 18 16 PM process SEVERE Error processing request at at at at at at at at ",XD-342,0,
Document jmx command line options and refer to jolokia,XD-341,0,
We should be able to write a script that can examine the table structure for a given HAWQ table and then extract the data from JSON without the custom script we are using now.,XD-340,0,
Investigate how efficiently we can integrate profiler into the performance test.,XD-339,0,
Create a load generator script which can generate messages at specific 1 Rate 2 Payload 3 Concurrency to a specific tcp udp port where a syslog adapter is listening.,XD-338,0,
"updated story points to 14 since 5 of us just participated in a 2 hour call, and we still need to discuss topology support after some dev spikes later this week",XD-335,0,
"TODO as part of this see XD 537 Get rid of so called Service layer in analytics project doesn t do much right now, and logic would better live in the Handler IMO Have REST controllers depend on XRepository in all cases",XD-332,0,
"For a this would be among other things message rate, number of messages",XD-327,0,
This would be based off the splunk project. The use of this adapter for storing tweet data is in We should be able to reproduce the use case as done in that demo,XD-318,0,
"The shell should be an executable delivered out of the box in much the same way that xd container and xd admin are right now. If we follow how redis mongo distribut the shell, it sits side by side with the other binaries",XD-315,0,
Expose runtime stats for core components.,XD-314,0,
Global option? Override for individual modules? module types?,XD-313,0,
WAR Vs. JVM Jolokia Agent Jolokia Vs. JVM MBeanServer Probably needs support for Spring Profiles.,XD-312,0,
Probably needs support for Spring Profiles.,XD-311,0,
So that we can validate the message content in the stream,XD-303,0,
To send a pre set message to process es ,XD-302,0,
"It would be nice if we have a git repo for Spring XD performance testing. This would enable us to have a common repository rather than inside spring xd as a subproject for all performance related code specific to any module, message middleware etc., ",XD-301,0,
"Twitter s streaming APIs have more capabilities than just the plain In particular we should support the filter.json option and the use of track as well as other request parameters delimited, language etc .",XD-298,0,
"I wanted to have a rollover feature when I was streaming tweets to a file overnight, just to avoid dealing with a single enormous file in case I collected more data than my demo could handle and needed to split it up .",XD-297,0,
"The s. The admin server already has a logging configuration which should be activated by the startup scripts, but the separate gemfire app doesn t.",XD-296,0,
the key used in writing key value pairs should be able to be specified declaratively.,XD-285,0,
Writing POJOs using CDK Data Avro We should support both partitioned and un partitioned. This story addresses only un partitioned. Document limitations in terms of which Java types are supported and not supported by the Avro serialization ,XD-282,0,
"This should be an optimization, to be verified, that aggregating data in memory, for example at the size of a HDFS block 64Mb often will result in increased performance vs. not aggregating data for writes.",XD-275,0,
"Based on message processing, a header in a Message can be added that contains the output file name. This will work together with the hdfs writer module so it can read the header and write the contents of the message to the specified file. ",XD-274,0,
"The file name should allow the use of date and time patterns, either JDK or Joda TBD .",XD-273,0,
"A strategy to roll over files that allows the user to choose between 1 the size of the file 2 the number of events items in the file 3 an idle timeout value that if exceeded, will close the file",XD-271,0,
"As XD, I need a persistent way to register job definitions beyond the map registry implementation provided by Spring Batch . ",XD-269,0,
"As an XD developer, I need to be able to use a batch job to stream data as a source. ",XD-267,0,
GET streams modules and GET streams The former returning links to the latter ,XD-265,0,
"Pagination support, maybe querying by name as well",XD-263,0,
This is the basic setup of the commands file no specific command implementations,XD-257,0,
Set up a basic Spring Shell project for XD Shell,XD-255,0,
For stream creation we need to be able to specify source sink processor filter transformer script etc. ,XD-251,0,
Need to create a basic client library to provide easier access to the XD REST API. ,XD-249,0,
Need to create a basic Spring Shell implementation to provide easier access to the XD REST API via an XD REST API Client library. ,XD-248,0,
Running on Cloud Foundry and other managed environments we need to be able to specify a Redis password in addition to host and port.,XD-247,0,
"As a user of XD, I want to be able to use a job as a source. To do so, we need the output of a job to be written to a message channel ",XD-246,0,
"As a developer, I need a way to deploy job configurations as well as the related custom code to XD. ",XD-245,0,
"As the XD system, I need to be able to execute a job or potentially a stream based on a given condition time, data existence, etc . This story is intended is for a local trigger implementation but remote triggers will also need to exist. ",XD-244,0,
An aggregate counter rolls up counts into discrete time buckets. There is an existing POC implementation in Java based off the library The README there has a good description of the desired feature set.,XD-236,0,
"we have a prototype gardenhose adapter that was built directly upon RestTemplate streaming on a background thread , but Spring Social Twitter has an issue on its 1.1 roadmap that is relevant ",XD-231,0,
This is needed for the use of the scheme to talk to HDFS over http.,XD-227,0,
"for example, when using the twittersearch source module, the hashTags are nested within entities , and the value for hashTags is itself an object with a text field, so the following would be needed to count the actual value of interest tap tweets ",XD-225,0,
"uses the SI twittersearch inbound channel adapter, which is no longer going to work once Twitter disallows anonymous searches. Ideally we update the example to use a new version of SI twitter that adds support for this as opposed to the XD workaround. ",XD-223,0,
Those property keys should then be provided as defaults for the placeholders in ,XD-220,0,
"The transform, filter, and script processor modules support passing in a for script variables. We need a default location on the classpath for users to provide custom properties files.",XD-217,0,
"Since the changes for XD 202, twittersearch requires authentication. Need to update the docs to reflect this.",XD-215,0,
The asciidoc wiki should have a section included in the Sidebar.asciidoc as well that describes the general usage of the DSL syntax.,XD-214,0,
There shouldn t be a need to do a mkdir p before sending data to a file sink.,XD-210,0,
"The wiki docs on creating custom modules have entire build.gradle files in them. Would be good to explore existing STS templates, maven archetypes, etc or create new ones for authoring custom modules.",XD-209,0,
The config file has a hardcoded value to locate the namenode. hdp configuration the fs.default.name proprety should be configurable and we should also support loading an external configuration file using hdp configuration ,XD-207,0,
I don t see that we have automated tests for the modules we provide out of the box. We could make the modules folder an Eclipse project which would also help solve XD 198 and add some integration tests similar to those documented here ,XD-203,0,
This will enable arbitrary processing logic to be used in a processing step. See ... script script lang groovy would be the essence of the module. Probably lang gets detected from the file extension.,XD-197,0,
Replace the existing DSL parser that uses string indexing with a more robust one based on a derivative of SpEL. This will provide a stable base on which to quickly iterate on syntax. ,XD-196,0,
When running in local mode no Redis no longer works. Change the object.,XD-195,0,
"If . and xml files in the modules dir, though that brings up the issue of classpath isolation.",XD-194,0,
"Currently internal config files are in META INF spring with fairly generic names. To avoid potential collisions if users add their own configuration in the classpath, we should have a more unique location, e.g. ",XD-193,0,
"With the new option of starting without requiring redis, the getting started documentation should reflect this easier way to start processing data.",XD-192,0,
a stream such as time filter file would load the groovy script that is located in the directory modules processor or perhaps in Not sure the benefit of having a subdirectory below processor just for scripts.,XD-188,0,
"This script will launch XD admin along with the module container. As part of this implementation, we will also remove the embedded options for XD admin container scripts.",XD-187,0,
Create StreamDeployer that does not depend on an adapter implementation,XD-186,0,
The current StreamServer depends on Call this RedisStreamServer and extract interface to allow alternate implementations,XD-185,0,
The redis specific beans that are defined in the current launcher.xml should move into this configuration file. ,XD-182,0,
The current incrementAndGet approach based off redis will not easily be applicable in local model deployment,XD-178,0,
"2 3 containers separate processes that the stream syslog tcp 1 container separate process that aggregates the data sent from those conainers, tcp severityFilter hdfs ",XD-175,0,
The use case is to write custom code that does processing on a specific domain class perhaps from twitter adapter or a tuple. Need to package up this code so that it can be used inside XD. ,XD-174,0,
"Document how to take an existing input output channel adapters in spring integration and add them as a XD source sink module. Should be as end user focused, step by step guide as possible. Consider including a getting started gradle pom.xml ",XD-173,0,
bottom home page list of projects data integration category landing pages related projects. ,XD-172,0,
A minimal project page of a top level project page that has basic information of docs and links to the github wiki page. No need to list maven coordinates.,XD-171,0,
"Add more structure, more easily find the reference guide. The style that is here is nice. ",XD-170,0,
Trying to the classpath to resolve this.,XD-169,0,
"Validate that modules have required channels declared according to their type. Currently the stream deployer accepts processors with no input, but the stream doesn t complete. We should fail earlier and more loudly.",XD-164,0,
We would like to have Redis driven from a config property file under XD HOME.,XD-156,0,
A processor module that accepts either the location of a groovy script resource or an inline script string . Also some discussion about a default classpath location for scripts. ,XD-155,0,
Spring config for simple gauge plus message handler to process message. There is some code common to RichGaugeHandler to coerce the payload to a double that should be refactored for reuse.,XD-153,0,
Spring config for rich gauge plus message handler to coerce a numeric or string payload to a double.,XD-152,0,
"Presently, Spring XD does not ship Windows binaries for Redis. However, Microsoft is actively working on supporting Redis on Windows. You can download Windows Redis binaries from ",XD-151,0,
The TCP source supports inbound binary data. We currently have to go through unnecessary conversion.,XD-145,0,
"If, say, xd dirt is ahead of a local config on the classpath, it s log4j.properties is found first.",XD-144,0,
We need to have an externalized property file under for the xd container admin scripts to use as options. ,XD-143,0,
The is pre instantiated to determine the type of object it will serve up.,XD-142,0,
"Currently, the install redis script uses relative path to determine redis source dist file. Since this is error prone, we need to fix it.",XD-141,0,
The syslog source currently is hard coded to use udp on port 11111. Need to parameterize the port and provide an option to use TCP.,XD-140,0,
"Building XD should not be part of the out first out of the box experience, but we should include some instructions on what targets are available, such as distXD.",XD-139,0,
Pointers to other documentation on how to install hadoop. ,XD-136,0,
"Show overall flow of data in a stream, the server components admin and container . How modules are deployed.",XD-135,0,
Asciidoc doctor might have one as part of it toolchain,XD-134,0,
Similar to what would show up on structure101 reports.,XD-133,0,
Based off SI tcp inbound adapter. This will allow for event fowarding.,XD-128,0,
Based off SI tcp inbound adapter. This will allow for event forwarding that can select among the existing SI options. ,XD-127,0,
"This will eventually be supplied by the admin server, but for now write it up by hand in the documentation",XD-126,0,
"Need to shutdown cleanly, no exception messages are shown. Order of components in the stream should be shut down from first to last opposite of creation ",XD-124,0,
The current default is but most new use 8020,XD-119,0,
"This should facilitate testing while avoiding any class dependencies. Also, log is a generally useful sink by itself and time is a more interesting source for testing should accept interval for the seconds between time messages .",XD-118,0,
This will enable the use of groovy scripts within modules.,XD-117,0,
It should provide an expression param for SpEL and have a default value of true accept everything .,XD-116,0,
It should provide an expression param for SpEL and have a default pass thru of the payload.,XD-115,0,
This is in the AdminMain and ContainerMain. Can get the environment property directly in java code unless provided explicitly on the command line using xdHomeDir.,XD-110,0,
"We are packaging separate scripts to start XDAdmin and XDContainer. The Gradle application plugin will generate an unwanted spring xd dirt scripts, this should be removed from the bin directory when creating a distribution zip.",XD-108,0,
"A ctrl c of xd admin results in exception messages about disconnecting from redis. 14 16 07,327 ERROR task scheduler 1 Redis command interrupted; nested exception is Command interrupted ",XD-107,0,
". xd container processing module Module from group tailtest with index 1 processing module Module from group tailtest with index 0 Logging of processing module should have log level, time..",XD-106,0,
should contain apache licence,XD-105,0,
should explain basic layout of the distribution,XD-104,0,
This will launch the in future will be able to select from a variety of middleware options.,XD-103,0,
"Provide optional command line arg to embed the container launcher, aka xd admin server. XDContainer.sh embeddAdmin",XD-102,0,
Caused by at at at ... 94 more,XD-99,0,
For people who are familiar with Spring Spring Integration provide documents that show how to add additional input sources sinks.,XD-98,0,
Put on the guide as a section in an input stream wiki page. ,XD-91,0,
"Put on the guide as a section in an streams wiki page. End user focused, no need to mention spring underpinning, impl details. ",XD-79,0,
Put on the guide as a section in an input sources wiki page. ,XD-78,0,
"in additional to existing tests that check for redis connection, we need to add tests that start stop stream server. ",XD-73,0,
stream should be able to ingest data from http ,XD-72,0,
The Java UUID class is known not to be the fasted implementation available. See and for high perf impls. ,XD-71,0,
"Based on a single process Spring Batch job, ETL of data from HDFS to MongoDB.",XD-69,0,
"Based on a single process running a Spring Batch job, support the ETL of data from HDFS to a RDBMS",XD-68,0,
Update a gemfire region.,XD-65,0,
Do not require a POJO in order to do end to end processing in a batch step.,XD-62,0,
"The difference between saving a new metric and updating an existing one needs to be defined. Suggest that if we try to save when an existing counter is already in the database to throw exception, such as ",XD-60,0,
"Nested tuple structures shoudl be supported, getTuple int index , getTuple String name ",XD-59,0,
Replace the use of Jedis with Lettuce as it has higher performance,XD-56,0,
"A Spring Integration based ServiceActivator that counts the occurrence of field names, from either a tuple data structure or a POJO, using the Spring XD metrics support.",XD-55,0,
A Spring Integration based ServiceActivator that counts the number of messages using the Spring XD metrics support,XD-54,0,
Start to explore how the DSL can cover both advanced non linear spring integration flows as well as spring batch jobs.,XD-53,0,
syntax tap somechannel key value somecounter ,XD-50,0,
"There is duplicated code in Redis based repositories that related to expiry behavior, move into a common shared helper class and or base class.",XD-45,0,
and have duplicated code that needs to be factored out into a one place. One such duplication is the determination of the key name to use for persistence. This should be abstracted out into a strategy helper class.,XD-44,0,
This provides common CRUD behavior and a shared interface that can be useful in testing scenarios. ,XD-43,0,
Gradle application plugin is a good starting point. this should be the main server that would host SI based modules to do syslog file ingestion as an example ,XD-40,0,
TODO break out into sub task or other stories.,XD-38,0,
multi project build. look to Spring Framework for source of starting point.,XD-37,0,
"A field value counter is useful for bar chart graphs, Strings on x axis and count on y axis. Maps well to zset in redis. Implementations for in memory and redis.",XD-31,0,
A simple counters can a number. Implementations for in memory and redis.,XD-30,0,
"A rich gauge stores a number and also rmd, min, max. Implementations for in memory and redis.",XD-29,0,
A gauge just stores a number. Implementations for in memory and redis.,XD-28,0,
"Initial simple handcoded implementation for straight through pipe and filter model, e.g. a b c",XD-24,0,
create enough of a design to develop additional stories.,XD-14,0,
"When there is support for boostrapping a http server in the reactor project, and inbound SI adapter and associated XD source module should be created.",XD-10,0,
Have a syslog.xml config file that can be added to a module and registered with a module registry.,XD-8,0,
The tuple data structure should be backward compatible in functionality for use in spring batch. Porting over FieldSet tests in spring batch to use the tuple data structure is one way help ensure that compatibility.,XD-7,0,
Simple file writer that has existed in the spring hadoop samples.,XD-2,0,
Base integration of core HDFS writer functionality with Spring Batch.,XD-1,0,
Move k8s SPI to a separate repo,XD-3715,1,
Upgrade XD Ambari release to 1.3 ,XD-3714,1,
Document limitations with HSQL when using composed jobs,XD-3708,1,
Bump Boot and spring cloud build Versions,XD-3705,1,
Support partitioning for Kafka even if count 1,XD-3702,1,
Improve Shell Connection Diagnostics,XD-3701,1,
Upgrade to SI 4.2.2.GA,XD-3696,1,
Upgrade to SHDP 2.2.1.GA,XD-3695,1,
Add Timestamp to XD Message History,XD-3693,1,
Improve Server Configuration Database Configuration section,XD-3690,1,
Update default configs to support Composed Jobs,XD-3689,1,
Update Docs to add configs changes for Composed jobs,XD-3687,1,
Add undeployed status for Mesos SPI,XD-3682,1,
Add undeployed status for k8s SPI,XD-3681,1,
Add consistent support for undeployed state across the deployers,XD-3680,1,
Add undeployed status for Lattice SPI,XD-3679,1,
Add undeployed status for CF SPI,XD-3678,1,
Create admin artifact and CI build for Lattice,XD-3675,1,
Move Mesos SPI to a separate repo,XD-3672,1,
Spike Explore options to scale modules from shell,XD-3671,1,
Spike Revisit the core design and document gaps,XD-3670,1,
Add Flo screenshots to Batch DSL section,XD-3669,1,
UI Add SPI type and version to about section,XD-3668,1,
UI Study PUI theming scope,XD-3666,1,
UI Replace Job references with Task,XD-3664,1,
UI Replace XD with Data Flow,XD-3662,1,
Create admin artifact for each Hadoop distro,XD-3659,1,
Add undeployed status for YARN SPI,XD-3656,1,
Documentation Flo for XD Batch,XD-3654,1,
Make SpEL usage consistent across all including custom modules,XD-3649,1,
